time,symbol,text,raw_text,url,src_sentiment,raw_title,source_name,sentiment
2019-06-26 09:00:00-04:00,ADBE,things company systems management wants know read invaluable insight creative software leader latest quarter,Read on for invaluable insight into the creative software leader's latest quarter.,https://www.fool.com/investing/2019/06/26/5-things-adobe-systems-management-wants-you-to-kno.aspx?source=iedfolrf0000001,Positive,5 Things Adobe Systems Management Wants You to Know,The Motley Fool,0
2019-06-25 16:38:34-04:00,ADBE,stocks sell company investor business daily stock market today stocks sell company,Investor's Business Daily's STOCK MARKET TODAY: Stocks sell off as Adobe.,https://www.youtube.com/watch?v=lEjwEGa8wlE&t=236s,Negative,Stocks Sell Off: Adobe,Investors Business Daily,0
2019-06-25 14:39:04-04:00,ADBE,software stocks salesforce company atlassian fall nasdaq tumbles software stocks cooled tuesday losers spanned salesforce company paycom servicenow atlassian software stocks among nasdaq composite top performers,"Software stocks cooled off on Tuesday as losers spanned Salesforce, Adobe, Paycom, ServiceNow and Atlassian. Software stocks have been among the Nasdaq composite's top performers in 2019.",https://www.investors.com/news/technology/software-stocks-fall-salesforce-stock-adobe-stock-nasdaq/,Negative,"Software Stocks Salesforce, Adobe, Atlassian Fall As Nasdaq Tumbles",Investors Business Daily,0
2019-06-23 12:38:00-04:00,ADBE,company stands strong week keysight delivers wayne himelsein one managers added company week put trailing stop keysight big move,"Wayne Himelsein, one of my managers, added Adobe this week and put a trailing stop on Keysight after a big move up.",https://www.forbes.com/sites/kenkam/2019/06/23/adobe-stands-out-in-a-strong-week-while-keysight-delivers/,Positive,Adobe Stands Out In A Strong Week While Keysight Delivers,Forbes,0
2019-06-23 08:00:00-04:00,ADBE,company one best software stocks around another quarter another beat another reason put stock radar,"Another quarter, another beat, another reason to put the stock on your radar.",https://www.fool.com/investing/2019/06/23/why-adobe-is-one-of-the-best-software-stocks-aroun.aspx?source=iedfolrf0000001,Positive,Why Adobe Is One of the Best Software Stocks Around,The Motley Fool,0
2019-06-21 13:52:52-04:00,ADBE,company continues one favorite growth stocks much better disrupter opposed disrupted stock,It is much better to own a disrupter as opposed to a disrupted stock.,https://seekingalpha.com/article/4271526-adobe-continues-one-favorite-growth-stocks?source=feed_tag_long_ideas,Positive,Adobe Continues To Be One Of My Favorite Growth Stocks,Seeking Alpha,0
2019-06-21 10:34:04-04:00,ADBE,company stock still king among cloud companies cloud applications kings market nothing proves company stock sharp rise earnings felt fell short post company stock still king among cloud companies appeared first investorplace,"Cloud applications are kings of this market and nothing proves that more than Adobe stock's sharp rise after earnings that some felt fell short.
The post Why Adobe Stock Is Still A King Among Cloud Companies appeared first on InvestorPlace.",https://investorplace.com/2019/06/why-adobe-stock-is-still-a-king-among-cloud-companies/,Positive,Why Adobe Stock Is Still A King Among Cloud Companies,InvestorPlace,0
2019-06-20 13:05:14-04:00,ADBE,transitioning engineering product company anjul bhambhri many roles inside startups tech companies clear marketers market salespeople sell engineers engineer roles like product manager seem obvious surface product managers product right,"Many roles inside of startups and tech companies are clear: marketers market, salespeople sell, engineers engineer. Then there are the roles like “product manager” that seem obvious on the surface (product managers “product,” right?",https://techcrunch.com/2019/06/20/transitioning-from-engineering-to-product-with-adobes-anjul-bhambhri/,Positive,Transitioning from engineering to product with Adobe’s Anjul Bhambhri,TechCrunch,0
2019-06-20 12:04:19-04:00,ADBE,stephens turns bullish company reasons company inc nasdaq adbe reported second quarter results tuesday prompted stephens adopt bullish stance software maker,Adobe Inc (NASDAQ: ADBE) reported second-quarter results Tuesday that prompted Stephens to adopt a bullish stance on the software maker.,https://www.benzinga.com/analyst-ratings/analyst-color/19/06/13950986/stephens-turns-bullish-on-adobe-3-reasons-why,Positive,Stephens Turns Bullish On Adobe: 3 Reasons Why,Benzinga,0
2019-06-20 10:11:50-04:00,ADBE,company lightroom arrives mac app store pro focused photo editing tool lightroom available mac app store marking first major company app available revamped version platform,"The pro-focused photo editing tool Lightroom is now available on the Mac App Store, marking the first major Adobe app to be available through the revamped version of the platform.",https://techcrunch.com/2019/06/20/adobe-lightroom-arrives-in-the-mac-app-store/,Neutral,Adobe Lightroom arrives in the Mac App Store,TechCrunch,0
2019-06-20 10:00:00-04:00,ADBE,company focus data driven business model likely sustain growth momentum company reported fiscal earnings recently company beat consensus expectations noted data driven model driving growth across segments,"Adobe reported its fiscal Q2 2019 earnings recently. The company beat consensus expectations, and noted that its data-driven model has been driving growth across segments.",https://www.forbes.com/sites/greatspeculations/2019/06/20/adobes-focus-on-a-data-driven-business-model-is-likely-to-sustain-growth-momentum/,Positive,Adobe's Focus On A Data-Driven Business Model Is Likely To Sustain Growth Momentum,Forbes,0
2019-06-20 08:47:00-04:00,ADBE,company adbe focus stock moves higher company adbe saw big move last session shares jumped day amid huge volumes,"Adobe (ADBE) saw a big move last session, as its shares jumped more than 5% on the day, amid huge volumes.",http://www.zacks.com/stock/news/432085/adobe-adbe-in-focus-stock-moves-52-higher,Positive,Adobe (ADBE) in Focus: Stock Moves 5.2% Higher,Zacks Investment Research,0
2019-06-20 08:17:00-04:00,ADBE,company stock tops time high record breaking quarter company continues defy expectations quarter quarter record results,The company continues to defy expectations with quarter after quarter of record results.,https://www.fool.com/investing/2019/06/20/adobe-stock-tops-all-time-high-on-record-breaking.aspx?source=iedfolrf0000001,Positive,Adobe Stock Tops All-Time High on Record-Breaking Quarter,The Motley Fool,0
2019-06-19 19:35:50-04:00,ADBE,cramer company another entity brick mortar deal jim cramer explains company services making tough retailers operate physical store,Jim Cramer explains why Adobe's services are making it more tough for retailers to operate in physical store.,https://www.youtube.com/watch?v=YETOPi6y690,Positive,Cramer: Adobe is another entity that brick and mortar has to deal with,CNBC Television,1
2019-06-19 18:14:00-04:00,ADBE,looking ahead earnings season looking ahead earnings season,Looking Ahead to the Q2 Earnings Season,http://www.zacks.com/commentary/431876/looking-ahead-to-the-q2-earnings-season,Neutral,Looking Ahead to the Q2 Earnings Season,Zacks Investment Research,1
2019-06-19 17:00:00-04:00,ADBE,company adbe stock spikes earnings beat buy company systems adbe reported second quarter earnings closing bell tuesday,Adobe Systems (ADBE) reported second quarter earnings after the closing bell on Tuesday.,http://www.zacks.com/stock/news/431835/adobe-adbe-stock-spikes-on-q2-earnings-beat-should-you-buy,Positive,Adobe (ADBE) Stock Spikes on Q2 Earnings Beat: Should You Buy?,Zacks Investment Research,1
2019-06-19 16:58:48-04:00,ADBE,company maintains strong momentum software specialist company reported fiscal second quarter earnings beat expectations shares jumped time high,Software specialist Adobe reported fiscal second-quarter earnings that beat expectations and shares jumped 5.2% to an all-time high.,https://www.fool.com/investing/2019/06/19/what-happened-in-the-stock-market-today.aspx?source=iedfolrf0000001,Positive,Adobe maintains strong momentum,The Motley Fool,1
2019-06-19 16:43:35-04:00,ADBE,investor business daily company earnings stocks rally fed rate cut signals company iqvia break shopify soars,"Stocks rally on Fed rate cut signals; Adobe, Iqvia break out, Shopify soars.",https://www.youtube.com/watch?v=_4njy_E0V10,Positive,Investor's Business Daily's: Adobe's Earnings,Investors Business Daily,1
2019-06-19 15:36:16-04:00,ADBE,top stock trades thursday company jabil inc moving earnings shopify hits new highs uber tries breakout let look top stock trades,"Adobe  and Jabil Inc are moving on earnings, while Shopify hits new highs and Uber tries to breakout. Let's look at some top stock trades.",https://investorplace.com/2019/06/5-top-stock-trades-for-thursday-uber-jbl-adbe-shop/,Positive,4 Top Stock Trades for Thursday,InvestorPlace,1
2019-06-19 14:41:26-04:00,ADBE,company analyst reactions print range solid boringly excellent company inc nasdaq adbe reported tuesday afternoon second quarter results highlighted year year revenue growth record quarterly high billion,Adobe Inc (NASDAQ: ADBE) reported Tuesday afternoon with second-quarter results that were highlighted by 25% year-over-year revenue growth to a record quarterly high of $2.74 billion.,https://www.benzinga.com/analyst-ratings/analyst-color/19/06/13944886/adobe-analyst-reactions-to-q2-print-range-from-solid-to-boringly-excellent,Positive,Adobe Analyst Reactions To Q2 Print Range From 'Solid' To 'Boringly Excellent',Benzinga,1
2019-06-19 13:14:56-04:00,ADBE,company jumps earnings beat shares company inc nasdaq adbe gained hours trading tuesday posting second quarter results,Shares of Adobe Inc. (NASDAQ:ADBE) gained 4.51% in after-hours trading on Tuesday after posting second-quarter results.,http://www.gurufocus.com/news/896609/adobe-jumps-on-earnings-beat-,Positive,Adobe Jumps on Earnings Beat,GuruFocus,1
2019-06-19 13:13:24-04:00,ADBE,company breaks toward week high beat company shares moved sharply higher wednesday session better expected second quarter financial results,Adobe shares moved sharply higher during Wednesday's session on better-than-expected second quarter financial results.,https://www.investopedia.com/adobe-breaks-out-toward-52-week-high-after-q2-beat-4690883,Positive,Adobe Breaks Out Toward 52-Week High After Q2 Beat,Investopedia,1
2019-06-19 12:50:27-04:00,ADBE,company shares rally quarter earnings beat shares company inc nasdaq adbe rose hours trading tuesday following release strong second quarter results,Shares of Adobe Inc. (NASDAQ:ADBE) rose more than 4% in after-hours trading on Tuesday following the release of strong second-quarter results.,http://www.gurufocus.com/news/896741/adobe-shares-rally-on-2ndquarter-earnings-beat,Positive,Adobe Shares Rally on 2nd-Quarter Earnings Beat,GuruFocus,1
2019-06-19 12:17:49-04:00,ADBE,watch cnbc full interview company ceo shantanu narayen shantanu narayen company chairman ceo joins squawk alley discuss company quarterly earnings global demand solution trade tariffs,"Shantanu Narayen, Adobe chairman and CEO, joins ""Squawk Alley"" to discuss the company's quarterly earnings, global demand and the solution to the trade tariffs.",https://www.youtube.com/watch?v=r2opk4QVV-w,Positive,Watch CNBC's full interview with Adobe CEO Shantanu Narayen,CNBC Television,1
2019-06-19 11:07:54-04:00,ADBE,jim cramer tackles jerome powell job safety company cbs viacom jim cramer takes look whether jerome powell job safe company earnings whether truly golden age creativity company ceo claims finally whether time cbs viacom merge,"Jim Cramer takes a look at whether or not Jerome Powell's job is safe, Adobe's earnings and whether or not we're truly in the 'golden age of creativity' as Adobe's CEO claims, and finally, whether or not now is the time for CBS and Viacom to merge.",https://www.youtube.com/watch?v=NT6_R_oWI1I,Neutral,"Jim Cramer Tackles Jerome Powell's Job Safety, Adobe and CBS and Viacom",The Street,1
2019-06-19 10:32:13-04:00,ADBE,analysts saying company earnings company inc released fiscal second quarter financial results markets closed tuesday,Adobe Inc. released its fiscal second-quarter financial results after the markets closed on Tuesday.,https://247wallst.com/technology-3/2019/06/19/what-analysts-are-saying-about-adobe-after-earnings-2/,Positive,What Analysts Are Saying About Adobe After Earnings,24/7 Wall Street,1
2019-06-19 09:19:00-04:00,ADBE,company adbe beats earnings revenue estimates company systems adbe fiscal second quarter results benefit strong product portfolio solid efforts product innovation,Adobe Systems' (ADBE) fiscal second-quarter results benefit from strong product portfolio and solid efforts for product innovation.,http://www.zacks.com/stock/news/431540/adobe-adbe-beats-earnings-and-revenue-estimates-in-q2,Positive,Adobe (ADBE) Beats Earnings and Revenue Estimates in Q2,Zacks Investment Research,1
2019-06-19 08:55:32-04:00,ADBE,company stock upgraded stephens earnings shares company systems inc adbe premarket trading wednesday company reported better expected results prior afternoon delivered disappointing outlook,"Shares of Adobe Systems Inc. ADBE, +0.43% are up 4.7% in premarket trading Wednesday after the company reported better-than-expected results the prior afternoon but delivered a disappointing outlook.",https://www.marketwatch.com/story/adobe-stock-upgraded-at-stephens-after-earnings-2019-06-19,Positive,Adobe stock upgraded at Stephens after earnings,Market Watch,1
2019-06-19 07:44:30-04:00,ADBE,dow jones futures eyes fed stock market rally company jumps earnings stock futures eyes turn fed meeting stock market rallied dovish ecb china trade news company jumped overnight strong earnings,Stock futures: All eyes turn to the Fed meeting after the stock market rallied on a dovish ECB and China trade news. Adobe jumped overnight on strong earnings.,https://www.investors.com/market-trend/stock-market-today/dow-jones-futures-fed-meeting-china-trade-news-apple-stock-market-rally-adobe-earnings/,Positive,Dow Jones Futures: Eyes On Fed After Stock Market Rally; Adobe Jumps On Earnings,Investors Business Daily,1
2019-06-18 22:30:07-04:00,ADBE,company inc adbe ceo shantanu narayen results earnings call transcript company inc adbe ceo shantanu narayen results earnings call transcript,Adobe Inc. (ADBE) CEO Shantanu Narayen on Q2 2019 Results - Earnings Call Transcript,https://seekingalpha.com/article/4270943-adobe-inc-adbe-ceo-shantanu-narayen-q2-2019-results-earnings-call-transcript?source=feed_sector_transcripts,Neutral,Adobe Inc. (ADBE) CEO Shantanu Narayen on Q2 2019 Results - Earnings Call Transcript,Seeking Alpha,0
2019-06-18 22:10:00-04:00,ADBE,hours company beats cloud performance company subscription model clearly working,Adobe's subscription model is clearly working.,https://www.fool.com/investing/2019/06/18/after-hours-adobe-beats-on-cloud-performance-cbs-r.aspx?source=iedfolrf0000001,Positive,After Hours: Adobe Beats on Cloud Performance,The Motley Fool,0
2019-06-18 21:05:00-04:00,ADBE,company systems offers another earnings beat shares rivaling time high creative software company latest record quarter,Shares are rivaling their all-time high after the creative software company's latest record quarter.,https://www.fool.com/investing/2019/06/18/adobe-systems-offers-another-earnings-beat.aspx?source=iedfolrf0000001,Positive,Adobe Systems Offers Another Earnings Beat,The Motley Fool,0
2019-06-18 19:08:00-04:00,ADBE,oracle cloud effect tomorrow earnings analysts estimating time high eps share along sales billion representing growth negative respectively orcl dropped last consecutive earnings releases even reporting beats top bottom lines,"Analysts are estimating an all-time high EPS of $1.07 a share along with sales of $10.95 billion, representing growth of 8% and negative 2.7% respectively. ORCL has dropped on the last 7 consecutive earnings releases even after reporting beats on both top and bottom-lines.",http://www.zacks.com/stock/news/431323/oracles-cloud-how-this-will-effect-tomorrow-earnings,Neutral,Oracle's Cloud: How This Will Effect Tomorrow Earnings,Zacks Investment Research,0
2019-06-18 18:47:13-04:00,ADBE,company beats quarterly estimates cloud strength shares rise company inc beat analysts estimates quarterly profit revenue tuesday driven growth digital media business houses flagship product creative cloud sending shares market,"Adobe Inc beat analysts' estimates for quarterly profit and revenue on Tuesday, driven by growth in its digital media business that houses its flagship product Creative Cloud, sending its shares up 4.6% after market.",https://www.reuters.com/article/us-adobe-results/adobe-beats-quarterly-estimates-on-cloud-strength-shares-rise-idUSKCN1TJ2RH,Positive,Adobe beats quarterly estimates on cloud strength; shares rise,Reuters,0
2019-06-18 17:25:03-04:00,ADBE,company systems adbe beats earnings revenue estimates company adbe delivered earnings revenue surprises respectively quarter ended may numbers hold clues lies ahead stock,"Adobe (ADBE) delivered earnings and revenue surprises of 2.81% and 1.64%, respectively, for the quarter ended May 2019. Do the numbers hold clues to what lies ahead for the stock?",http://www.zacks.com/stock/news/431279/adobe-systems-adbe-beats-q2-earnings-and-revenue-estimates,Positive,Adobe Systems (ADBE) Beats Q2 Earnings and Revenue Estimates,Zacks Investment Research,0
2019-06-18 16:39:08-04:00,ADBE,company earnings adbe stock surges earnings revenue beat company earnings adbe stronger analysts called helping lift adbe stock bell tuesday afternoon post company earnings adbe stock surges earnings revenue beat appeared first investorplace,"Adobe earnings (ADBE) were stronger than what analysts called for, helping to lift ADBE stock more than 2% after the bell Tuesday afternoon.
The post Adobe Earnings: ADBE Stock Surges on Q2 Earnings, Revenue Beat appeared first on InvestorPlace.",https://investorplace.com/2019/06/adobe-earnings-adbe-stock-3/,Positive,"Adobe Earnings: ADBE Stock Surges on Q2 Earnings, Revenue Beat",InvestorPlace,0
2019-06-18 16:30:49-04:00,ADBE,company beats top bottom lines cnbc josh lipton reports company quarterly earnings numbers,CNBC's Josh Lipton reports on Adobe's quarterly earnings numbers.,https://www.youtube.com/watch?v=993m4JYEmcU,Positive,Adobe beats on top and bottom lines,CNBC Television,0
2019-06-18 16:30:29-04:00,ADBE,photoshop maker company beats revenue profit estimates company inc beat analysts estimates quarterly profit revenue tuesday driven growth digital media business houses flagship product creative cloud,"Adobe Inc beat analysts' estimates for quarterly profit and revenue on Tuesday, driven by growth in its digital media business that houses its flagship product Creative Cloud.",https://www.reuters.com/article/us-adobe-results/photoshop-maker-adobe-beats-revenue-profit-estimates-idUSKCN1TJ2RH,Positive,"Photoshop maker Adobe beats revenue, profit estimates",Reuters,0
2019-06-18 16:26:16-04:00,ADBE,company stock ticks higher quarter beats street outlook company inc shares rose extended session tuesday brief dip software company quarterly results beat wall street estimates outlook,"Adobe Inc. shares rose in the extended session Tuesday, after a brief dip, as the software company's quarterly results beat Wall Street estimates but its outlook did not.",https://www.marketwatch.com/story/adobe-stock-ticks-higher-as-quarter-beats-street-outlook-doesnt-2019-06-18,Positive,"Adobe stock ticks higher as quarter beats Street, outlook doesn't",Market Watch,0
2019-06-18 16:18:57-04:00,ADBE,company shares trade higher record sales company inc shares traded higher reporting record second quarter revenues,Adobe Inc. shares traded higher after reporting record second-quarter revenues.,https://www.benzinga.com/news/earnings/19/06/13939766/adobe-shares-trade-higher-after-record-q2-sales,Positive,Adobe Shares Trade Higher After Record Q2 Sales,Benzinga,0
2019-06-18 16:17:40-04:00,ADBE,company stock nears buy point second quarter earnings beat digital media marketing software maker company late tuesday beat wall street targets fiscal second quarter company earnings news sent stock higher extended trading,Digital media and marketing software maker Adobe late Tuesday beat Wall Street's targets for its fiscal second quarter. The Adobe earnings news sent its stock higher in extended trading.,https://www.investors.com/news/technology/adobe-earnings-q2-2019-adobe-stock-branch/,Positive,Adobe Stock Nears Buy Point After Second-Quarter Earnings Beat,Investors Business Daily,0
2019-06-18 16:16:00-04:00,ADBE,company rises despite soft guidance company expects fiscal third quarter earnings revenue analysts looking,Adobe expects fiscal third-quarter earnings and revenue that are below what analysts were looking for.,https://www.cnbc.com/2019/06/18/adobe-earnings-q2-2019.html,Positive,Adobe rises despite soft guidance,CNBC,0
2019-06-18 11:18:40-04:00,ADBE,company stock nears buy point ahead second quarter earnings report company stock approaching buy point ahead fiscal second quarter report due close tuesday company earnings news could provide catalyst cloud software maker,Adobe stock is approaching a buy point ahead of its fiscal second-quarter report due after the close Tuesday. The Adobe earnings news could provide a catalyst for the cloud software maker.,https://www.investors.com/news/technology/adobe-earnings-q2-2019-adobe-stock/,Positive,Adobe Stock Nears Buy Point Ahead Of Second-Quarter Earnings Report,Investors Business Daily,0
2019-06-18 10:37:00-04:00,ADBE,company looks cheap trade ahead earnings fast money traders share first moves market open,"The ""Fast Money"" traders share their first moves for the market open.",https://www.cnbc.com/2019/06/18/adobe-looks-cheap-to-trade-ahead-of-earnings.html,Positive,Adobe looks cheap to trade ahead of earnings,CNBC,0
2019-06-18 07:26:18-04:00,ADBE,company systems earnings preview tuesday june company systems nasdaq adbe release latest earnings report,"On Tuesday, June 18, Adobe Systems (NASDAQ: ADBE) will release its latest earnings report.",https://www.benzinga.com/news/earnings-previews/19/06/13933987/adobe-systemss-earnings-preview,Positive,Adobe Systems Q2 Earnings Preview,Benzinga,0
2019-06-17 16:32:19-04:00,ADBE,company fresco app bring real painting physics ipad art tool formerly project gemini arrives later,"The tool, formerly Project Gemini, arrives later in 2019.",https://www.cnet.com/news/adobe-fresco-app-brings-real-physics-painting-drawing-sketching-to-ipad-art/,Positive,Adobe's Fresco app will bring real painting physics to iPad art,CNET,0
2019-06-17 16:08:39-04:00,ADBE,company stocks jump market uptrend gains traction investor business daily stock market today,Investor's Business Daily's STOCK MARKET TODAY.,https://www.youtube.com/watch?v=3Js1dmsKRGI&t=332s,Positive,Adobe: Stocks Jump As Market Uptrend Gains Traction,Investors Business Daily,0
2019-06-17 12:16:39-04:00,ADBE,company new painting drawing app called company fresco company upcoming drawing painting app official name company fresco inspired classic technique applying pigment wet plaster app intended inspire spontaneous creativity,"Adobe’s upcoming drawing and painting app has an official name: Adobe Fresco. Inspired by the classic technique of applying pigment to wet plaster, the app is intended “to inspire spontaneous creativity.",https://techcrunch.com/2019/06/17/adobes-new-painting-and-drawing-app-will-be-called-adobe-fresco/,Positive,Adobe’s new painting and drawing app will be called Adobe Fresco,TechCrunch,0
2019-06-17 10:03:00-04:00,ADBE,increasing demand digital transformation solutions boosted company fiscal results company reports fiscal earnings tuesday june trefis anticipate benefits company alliance microsoft sap start contributing strength company analytics business,"Adobe reports its fiscal Q2 2019 earnings on Tuesday, June 18. Trefis anticipate the benefits of Adobe’s alliance with Microsoft and SAP to start contributing to strength in the company’s analytics business.",https://www.forbes.com/sites/greatspeculations/2019/06/17/increasing-demand-for-digital-transformation-solutions-should-have-boosted-adobes-fiscal-q2-results/,Positive,Increasing Demand For Digital Transformation Solutions Should Have Boosted Adobe's Fiscal Q2 Results,Forbes,0
2019-06-17 08:23:53-04:00,ADBE,company oracle near time highs ahead earnings company oracle shares vulnerable despite trading near time highs suggesting investors tighten risk parameters,"Adobe and Oracle shares are vulnerable despite trading near all-time highs, suggesting that investors tighten up risk parameters.",https://www.investopedia.com/oracle-and-adobe-near-all-time-highs-ahead-of-earnings-4690663,Positive,Adobe and Oracle Near All-Time Highs Ahead of Earnings,Investopedia,0
2019-06-17 08:14:00-04:00,ADBE,company systems adbe report earnings store company systems adbe fiscal second quarter results likely driven strength creative cloud innovation,Adobe Systems' (ADBE) fiscal second-quarter results are likely to be driven by strength in Creative Cloud and innovation.,http://www.zacks.com/stock/news/430366/adobe-systems-adbe-to-report-q2-earnings-whats-in-store,Neutral,Adobe Systems (ADBE) to Report Q2 Earnings: What's in Store?,Zacks Investment Research,0
