time,symbol,text,raw_text,url,src_sentiment,raw_title,source_name,sentiment
2019-06-14 18:05:13-04:00,PYPL,facebook cryptocurrency venture getting new backers cnbc melissa lee fast money traders tim seymour steve grasso dan nathan guy adami,"With CNBC's Melissa Lee and the Fast Money traders, Tim Seymour, Steve Grasso, Dan Nathan and Guy Adami.",https://www.youtube.com/watch?v=x2H_0owMhRA,Positive,Facebook's cryptocurrency venture getting some new backers,CNBC Television,0
2019-06-16 14:44:40-04:00,PYPL,millions venmo transactions scraped warning privacy settings computer science student scraped seven million venmo transactions prove users public activity still easily obtained year privacy researcher downloaded hundreds millions venmo transactions similar feat dan salmon said scraped transactions cumulative six months raise awareness warn,"A computer science student has scraped seven million Venmo transactions to prove that users’ public activity can still be easily obtained, a year after a privacy researcher downloaded hundreds of millions of Venmo transactions in a similar feat. Dan Salmon said he scraped the transactions during a cumulative six months to raise awareness and warn […]",https://techcrunch.com/2019/06/16/millions-venmo-transactions-scraped/,Negative,Millions of Venmo transactions scraped in warning over privacy settings,TechCrunch,0
2019-06-18 08:32:15-04:00,PYPL,ten tech stocks buy recent report rbc capital markets reveals tech stocks believes likely outperform next seven years,A recent report from RBC Capital Markets reveals the tech stocks it believes are most likely to outperform over the next seven years.,https://investorplace.com/2019/06/10-tech-stocks-to-buy-now-for-2025/,Positive,Ten Tech Stocks to Buy Now for 2025,InvestorPlace,0
2019-06-20 16:28:07-04:00,PYPL,paypal coo bill ready depart stock falls late trading paypal holdings inc shares pypl fell hours trading thursday company announced chief operating officer bill ready would leaving company end year pursue entrepreneurial interests outside company,"PayPal Holdings Inc. shares PYPL, +1.41% fell 1.1% in after-hours trading Thursday after the company announced that Chief Operating Officer Bill Ready would be leaving the company at the end of the year ""to pursue entrepreneurial interests outside the company.",https://www.marketwatch.com/story/paypal-coo-bill-ready-to-depart-stock-falls-in-late-trading-2019-06-20,Negative,"PayPal COO Bill Ready to depart, stock falls in late trading",Market Watch,0
2019-06-21 07:43:57-04:00,PYPL,dow jones futures canopy growth paypal lululemon exelixis active stock futures canopy growth reported wider expected loss paypal lululemon athletica exelixis moved overnight news,"Stock futures: Canopy Growth reported a wider-than-expected Q4 loss. PayPal, Lululemon Athletica and Exelixis moved overnight on news.",https://www.investors.com/market-trend/stock-market-today/dow-jones-futures-canopy-growth-stock-paypal-stock-lululemon-stock-exelixis/,Positive,"Dow Jones Futures: Canopy Growth, PayPal, Lululemon, Exelixis Active",Investors Business Daily,0
2019-06-21 10:14:07-04:00,PYPL,paypal coo bill ready depart end paypal chief operating officer bill ready leaving company end year paypal announced via statement issued thursday exec first joined paypal acquired startup payments gateway braintree back million cash,"PayPal Chief Operating Officer Bill Ready is leaving the company at the end of the year, PayPal announced via a statement issued on Thursday. The exec had first joined PayPal when it acquired his startup, the payments gateway Braintree back in 2013 for $800 million in cash.",https://techcrunch.com/2019/06/21/paypal-coo-bill-ready-to-depart-at-end-of-2019/,Negative,PayPal COO Bill Ready to depart at end of 2019,TechCrunch,0
2019-06-21 10:43:41-04:00,PYPL,paypal stock slips high level executive announces departure paypal holdings said friday chief operating officer bill ready formerly chief executive braintree venmo developer step paypal stock fell news,"PayPal Holdings said Friday that its chief operating officer Bill Ready, formerly the chief executive of Braintree and Venmo developer, will step down. PayPal stock fell on the news.",https://www.investors.com/news/technology/paypal-pypl-stock-coo-ready-leaving-venmo/,Negative,PayPal Stock Slips As High-Level Executive Announces Departure,Investors Business Daily,0
2019-06-21 12:39:13-04:00,PYPL,paypal analysts concerned executive change paypal holdings inc nasdaq pypl announced thursday coo bill ready leave company end pursue entrepreneurial interests elsewhere,"Paypal Holdings Inc (NASDAQ: PYPL) announced Thursday COO Bill Ready will leave the company at the end of 2019 to ""pursue entrepreneurial interests"" elsewhere.",https://www.benzinga.com/analyst-ratings/analyst-color/19/06/13957648/paypal-analysts-not-too-concerned-about-executive-change,Positive,PayPal Analysts Not Too Concerned About Executive Change,Benzinga,0
2019-06-21 16:09:44-04:00,PYPL,google pay expands integration paypal online merchants google paypal strategic partners time companies announced paypal would become payment method android pay service later rebranded google pay,"Google and PayPal have been strategic partners for some time. The companies in 2017 announced that PayPal would become a payment method in Android Pay, the service that later rebranded as Google Pay.",https://techcrunch.com/2019/06/21/google-pay-expands-its-integration-with-paypal-to-online-merchants/,Positive,Google Pay expands its integration with PayPal to online merchants,TechCrunch,0
2019-06-24 09:30:00-04:00,PYPL,google pay paypal integration revs payments system market alphabet googl google integrating deeper paypal boost presence digital payments industry competitive apple amazon samsung square,"Alphabet's (GOOGL) Google is integrating deeper with PayPal to boost presence in digital payments industry and be more competitive against Apple, Amazon, Samsung and Square.",http://www.zacks.com/stock/news/433507/google-pay-paypal-integration-revs-up-payments-system-market,Positive,"Google Pay, PayPal Integration Revs Up Payments System Market",Zacks Investment Research,0
2019-06-26 08:40:17-04:00,PYPL,stock showdown paypal stock beat square stock every time square paypal two superstars digital payments could better buy,Square & PayPal are two superstars in digital payments. But which could be the better buy?,https://investorplace.com/2019/06/paypal-stock-will-beat-square-stock/,Positive,Stock Showdown: PayPal Stock Will Beat Square Stock Every Time,InvestorPlace,0
2019-06-26 13:33:00-04:00,PYPL,top stocks buy july head latter half year five stocks contributors radars,"As we head into the latter half of the year, here are five stocks on our contributors’ radars.",https://www.fool.com/investing/2019/06/26/5-top-stocks-to-buy-in-july.aspx?source=iedfolrf0000001,Positive,5 Top Stocks to Buy in July,The Motley Fool,0
2019-06-27 13:37:18-04:00,PYPL,thoughts paypal askhalftime halftime report traders answer viewer questions paypal,"The ""Halftime Report"" traders answer viewer questions on PayPal.",https://www.youtube.com/watch?v=ckBirGXb67s&t=71s,Positive,Thoughts on PayPal? #AskHalftime,CNBC Television,0
2019-07-01 10:46:39-04:00,PYPL,best stocks buy sizable drops stocks flying high morning three best stocks buy profits heading new week,Stocks are flying high this morning. Here are three of the best stocks to buy for profits heading into the new week.,https://investorplace.com/2019/07/best-stocks-to-buy-after-sizable-drops/,Positive,3 Best Stocks to Buy After Sizable Drops,InvestorPlace,0
2019-07-01 12:26:00-04:00,PYPL,three high growth stocks could soar momo carvana paypal investment short list,"Here's why Momo, Carvana, and PayPal should be on your investment short list.",https://www.fool.com/investing/2019/07/01/3-high-growth-stocks-that-could-soar.aspx?source=iedfolrf0000001,Positive,Three High-Growth Stocks That Could Soar,The Motley Fool,0
2019-07-03 07:15:00-04:00,PYPL,disruptor alert companies changing e commerce landscape amazon tops list course overlook shopify paypal,"Amazon tops the list, of course, but don't overlook Shopify and PayPal.",https://www.fool.com/investing/2019/07/03/disruptor-alert-companies-changing-e-commerce.aspx?source=iedfolrf0000001,Positive,Disruptor Alert: 3 Companies Changing the E-Commerce Landscape,The Motley Fool,0
2019-07-06 12:18:00-04:00,PYPL,three top tech stocks buy right looking next big thing tech look,Looking for the next big thing in tech? Look no further.,https://www.fool.com/investing/2019/07/06/3-top-tech-stocks-to-buy-right-now.aspx?source=iedfolrf0000001,Positive,Three Top Tech Stocks to Buy Right Now.,The Motley Fool,0
2019-07-07 12:16:00-04:00,PYPL,great stocks buy july trends friends stocks,The trends are your friends with these stocks.,https://www.fool.com/investing/2019/07/07/5-great-stocks-to-buy-in-july.aspx?source=iedfolrf0000001,Positive,5 Great Stocks to Buy in July,The Motley Fool,0
2019-07-08 17:45:20-04:00,PYPL,paypal pypl stock moves know paypal pypl closed recent trading day moving previous trading session,"Paypal (PYPL) closed the most recent trading day at $116.95, moving -0.18% from the previous trading session.",http://www.zacks.com/stock/news/439455/paypal-pypl-stock-moves-018-what-you-should-know,Neutral,Paypal (PYPL) Stock Moves -0.18%: What You Should Know,Zacks Investment Research,0
2019-07-09 09:11:00-04:00,PYPL,better buy paypal holdings vs american express companies knee deep collecting transaction fees one unique opportunities benefit digital payments evolve,"Both companies are knee-deep in collecting transaction fees, but only one has more unique opportunities to benefit as digital payments evolve.",https://www.fool.com/investing/2019/07/09/better-buy-paypal-holdings-vs-american-express.aspx?source=iedfolrf0000001,Neutral,Better Buy: PayPal Holdings vs. American Express.,The Motley Fool,0
2019-07-09 16:46:12-04:00,PYPL,paypal says earnings get bigger boost mercadolibre investment paypal holdings inc pypl disclosed tuesday next earnings report get big boost strategic investments payments company invested latin american e commerce company mercadolibre inc,"PayPal Holdings Inc. PYPL, +1.21% disclosed Tuesday that its next earnings report will get a big boost from strategic investments, after the payments company invested in Latin American e-commerce company MercadoLibre Inc.",https://www.marketwatch.com/story/paypal-says-earnings-will-get-a-bigger-boost-after-mercadolibre-investment-2019-07-09,Positive,PayPal says earnings will get a bigger boost after MercadoLibre investment,Market Watch,0
2019-07-10 11:20:14-04:00,PYPL,paypal gets unexpected boost paypal gets boost latin america,PayPal gets a boost from Latin America.,https://www.fool.com/investing/2019/07/10/stock-market-news-amazon-nears-1-trillion-again-pa.aspx?source=iedfolrf0000001,Positive,PayPal Gets an Unexpected Boost,The Motley Fool,0
2019-07-10 17:57:00-04:00,PYPL,paypal shares tell story big demand company forefront shift cashless society paypal shares seeing unusual buy signals,"With the company at the forefront of the shift to a cashless society, PayPal shares are seeing unusual buy signals.",https://www.investopedia.com/paypal-shares-tell-a-story-of-big-demand-4692631,Positive,PayPal Shares Tell a Story of Big Demand,Investopedia,0
2019-07-10 18:41:00-04:00,PYPL,better buy shopify vs paypal profit taking friction e commerce one smoother path toward high returns shareholders,Both profit by taking some of the friction out of e-commerce. One has a smoother path toward high returns for shareholders.,https://www.fool.com/investing/2019/07/10/better-buy-shopify-vs-paypal.aspx?source=iedfolrf0000001,Neutral,Better Buy: Shopify vs PayPal,The Motley Fool,0
2019-07-11 10:10:14-04:00,PYPL,paypal pypl poised beat earnings estimates paypal pypl impressive earnings surprise history currently possesses right combination two key ingredients likely beat next quarterly report,Paypal (PYPL) has an impressive earnings surprise history and currently possesses the right combination of the two key ingredients for a likely beat in its next quarterly report.,http://www.zacks.com/stock/news/441037/why-paypal-pypl-is-poised-to-beat-earnings-estimates-again,Positive,Why Paypal (PYPL) is Poised to Beat Earnings Estimates Again,Zacks Investment Research,0
2019-07-12 12:14:11-04:00,PYPL,stocks driving market time highs stock market year date trading fresh time highs hot stocks behind record rally,The stock market is up 20% year-to-date and trading at fresh all time highs - these are the hot stocks behind the record rally.,https://investorplace.com/2019/07/10-stocks-driving-the-market-to-all-time-highs-and-why/,Positive,10 Stocks Driving the Market to All-Time Highs (And Why),InvestorPlace,0
2019-07-12 16:35:00-04:00,PYPL,paypal stock gained first half digital payments specialist posted impressive business results continued explore growth opportunities,The digital-payments specialist posted impressive business results and continued to explore further growth opportunities.,https://www.fool.com/investing/2019/07/12/why-paypals-stock-gained-36-in-the-first-half-of-2.aspx?source=iedfolrf0000001,Positive,Why PayPal's Stock Gained 36% in the First Half of 2019,The Motley Fool,0
2019-07-15 19:16:50-04:00,PYPL,paypal launches international money transfer service xoom across europe u payments company paypal expanding europe launching international money transfers service xoom britain countries across continent,U.S. payments company PayPal  is expanding further in Europe by launching its international money transfers service Xoom in Britain and 31 other countries across the continent.,https://www.reuters.com/article/us-paypal-money-transfers/paypal-launches-international-money-transfer-service-xoom-across-europe-idUSKCN1UA2JW,Positive,PayPal launches international money transfer service Xoom across Europe,Reuters,0
2019-07-16 10:45:00-04:00,PYPL,paypal makes big international move xoom digital payment processor expanding money transfer service markets across europe,The digital payment processor is expanding its money transfer service into 32 markets across Europe.,https://www.fool.com/investing/2019/07/16/paypal-makes-a-big-international-move-with-xoom.aspx,Positive,PayPal Makes a Big International Move With Xoom,The Motley Fool,0
2019-07-17 10:32:31-04:00,PYPL,paypal pypl earnings expected grow buy paypal pypl possesses right combination two key ingredients likely earnings beat upcoming report get prepared key expectations,Paypal (PYPL) possesses the right combination of the two key ingredients for a likely earnings beat in its upcoming report. Get prepared with the key expectations.,http://www.zacks.com/stock/news/443820/paypal-pypl-earnings-expected-to-grow-should-you-buy,Positive,Paypal (PYPL) Earnings Expected to Grow: Should You Buy?,Zacks Investment Research,0
2019-07-18 11:57:38-04:00,PYPL,paypal analyst merchant acceptance lead widening amazon bitcoin paypal holdings inc nasdaq pypl made four net additions u top internet retailers second quarter versus amazon com inc nasdaq amzn two merchant adds bitcoin flat performance according morgan stanley,"PayPal Holdings Inc (NASDAQ: PYPL) made four net additions of U.S. top 500 internet retailers in the second quarter versus Amazon.com, Inc (NASDAQ: AMZN)'s two merchant adds and Bitcoin’s flat performance, according to Morgan Stanley.",https://www.benzinga.com/analyst-ratings/analyst-color/19/07/14096128/paypal-analyst-merchant-acceptance-lead-widening-over-amazon-bitcoin,Positive,"PayPal Analyst: Merchant Acceptance Lead Widening Over Amazon, Bitcoin",Benzinga,0
2019-07-19 07:03:54-04:00,PYPL,economic outlook paypal earnings reaping benefits investments paypal holdings inc reports earnings next wednesday reap rewards recent bets payments players,"When PayPal Holdings Inc. reports earnings next Wednesday, it will reap the rewards of some recent bets on payments players.",https://www.marketwatch.com/story/paypal-earnings-reaping-the-benefits-of-investments-2019-07-19,Positive,Economic Outlook: PayPal earnings: Reaping the benefits of investments,Market Watch,0
2019-07-19 08:45:07-04:00,PYPL,reasons growth investors love paypal pypl paypal pypl could produce exceptional returns solid growth attributes,Paypal (PYPL) could produce exceptional returns because of its solid growth attributes.,http://www.zacks.com/stock/news/445301/3-reasons-growth-investors-will-love-paypal-pypl,Positive,3 Reasons Growth Investors Will Love Paypal (PYPL),Zacks Investment Research,0
2019-07-19 10:11:00-04:00,PYPL,paypal pypl report earnings offing paypal pypl second quarter results likely benefit strong product portfolio strategic partnerships,PayPal's (PYPL) second-quarter results are likely to benefit from strong product portfolio and strategic partnerships.,http://www.zacks.com/stock/news/445567/paypal-pypl-to-report-q2-earnings-whats-in-the-offing,Neutral,PayPal (PYPL) to Report Q2 Earnings: What's in the Offing?,Zacks Investment Research,0
2019-07-19 13:54:52-04:00,PYPL,paypal price target increased wedbush halftime report traders debate wedbush call increase price target paypal,"The ""Halftime Report"" traders debate Wedbush's call to increase its price target on PayPal to $140 from $125.",https://www.youtube.com/watch?v=ki_7jqtw1IM,Positive,PayPal price target increased at Wedbush,CNBC Television,0
2019-07-20 10:46:00-04:00,PYPL,paypal continue win streak reports earnings company made unexpected strategic investment expand payment processing empire,The company has made an unexpected strategic investment to expand its payment processing empire.,https://www.fool.com/investing/2019/07/20/can-paypal-continue-win-streak-q2-earnings.aspx,Positive,Can PayPal Continue Win Streak When It Reports Q2 Earnings?,The Motley Fool,0
2019-07-22 09:01:00-04:00,PYPL,stocks must buys ahead earnings several sector bellwethers projected outperform earnings estimates week,Several sector bellwethers are projected to outperform their earnings estimates this week.,http://www.zacks.com/stock/news/446575/these-%24100b%2B-stocks-are-must-buys-ahead-of-q2-earnings,Positive,These $100B+ Stocks are Must-Buys Ahead of Q2 Earnings,Zacks Investment Research,0
2019-07-22 10:04:01-04:00,PYPL,paypal upcoming results could among messiest recent memory says analyst bernstein analyst harshita rawat expects paypal holdings inc pypl report one messiest quarters recent memory given many moving pieces around volume growth venmo monetization pricing actions credit divestiture impact foreign exchange gains investments recent ebay,"Bernstein analyst Harshita Rawat expects that PayPal Holdings Inc. PYPL, +0.39% will report ""one of the messiest quarters"" in recent memory ""given many moving pieces around volume growth, Venmo monetization, pricing actions, credit divestiture impact, [foreign exchange], gains on investments, recent M&A & eBay",https://www.marketwatch.com/story/paypals-upcoming-results-could-be-among-the-messiest-in-recent-memory-says-analyst-2019-07-22,Negative,"PayPal's upcoming results could be among the 'messiest' in recent memory, says analyst",Market Watch,0
2019-07-22 16:32:00-04:00,PYPL,invest paypal pypl stock earnings paypal pypl impressive ytd continuing strong growth trend since company spin ebay ebay investors expect pypl earnings report,"PayPal (PYPL) is up an impressive 42.5% YTD, continuing a very strong growth trend since the company's spin-off from eBay (EBAY). Here's what investors should expect from PYPL's Q2 earnings report.",http://www.zacks.com/stock/news/446916/should-you-invest-in-paypal-pypl-stock-before-q2-earnings,Neutral,Should You Invest In PayPal (PYPL) Stock Before Q2 Earnings?,Zacks Investment Research,0
2019-07-22 18:13:00-04:00,PYPL,portfolio strength benefit paypal pypl earnings paypal pypl strengthening product services portfolio likely aid second quarter results,PayPal's (PYPL) strengthening product and services portfolio is likely to aid second-quarter 2019 results.,http://www.zacks.com/stock/news/446981/will-portfolio-strength-benefit-paypals-pypl-q2-earnings,Positive,Will Portfolio Strength Benefit PayPal's (PYPL) Q2 Earnings?,Zacks Investment Research,0
2019-07-23 07:06:00-04:00,PYPL,buy high flying stocks ahead earnings week prudent invest stocks likely beat earnings estimates second quarter week,It will be prudent to invest in stocks that are likely to beat earnings estimates in the second quarter this week.,http://www.zacks.com/stock/news/447208/buy-5-high-flying-stocks-ahead-of-q2-earnings-this-week,Positive,Buy 5 High-Flying Stocks Ahead of Q2 Earnings This Week,Zacks Investment Research,0
2019-07-23 07:09:58-04:00,PYPL,paypal stock could strong earnings season pypl stock big year date stop paypal stock heading even higher strong earnings post paypal stock could strong earnings season appeared first investorplace,"PYPL stock is up big year-to-date, but that shouldn't stop PayPal stock from heading even higher after strong Q2 earnings.
The post Why PayPal Stock Could Have a Strong Earnings Season appeared first on InvestorPlace.",https://investorplace.com/2019/07/paypal-stock-strong-earnings-season/,Positive,Why PayPal Stock Could Have a Strong Earnings Season,InvestorPlace,0
2019-07-23 08:50:00-04:00,PYPL,paypal pypl might surprise earnings season paypal pypl seeing favorable earnings estimate revision activity positive zacks earnings esp heading earnings season,PayPal (PYPL) is seeing favorable earnings estimate revision activity and has a positive Zacks Earnings ESP heading into earnings season.,http://www.zacks.com/stock/news/447260/why-paypal-pypl-might-surprise-this-earnings-season,Positive,Why PayPal (PYPL) Might Surprise This Earnings Season,Zacks Investment Research,0
2019-07-23 15:21:33-04:00,PYPL,earnings charts sizzle charts spectacular earnings track records strong,Their charts are spectacular and their earnings track records are strong.,https://www.youtube.com/watch?v=V_KQwOEUMQc,Positive,5 Earnings Charts That Have the Sizzle,Zacks Investment Research,0
2019-07-24 06:46:00-04:00,PYPL,forget amazon e commerce stocks watch investors looking alternative e commerce stocks consider shopify paypal etsy,"Investors looking for alternative e-commerce stocks should consider Shopify, PayPal, and Etsy.",https://www.fool.com/investing/2019/07/24/forget-amazon-here-are-3-ecommerce-stocks-to-watch.aspx,Positive,Forget Amazon: Here Are 3 E-Commerce Stocks to Watch,The Motley Fool,0
2019-07-24 08:54:00-04:00,PYPL,tech stocks buy pre earnings trade talk prospects technology sector likely benefit u china trade talk likely resume although amicable deal nowhere seen,The technology sector is likely to benefit as U.S.-China trade talk is likely to resume although an amicable deal is nowhere to be seen.,http://www.zacks.com/stock/news/448163/6-tech-stocks-to-buy-pre-q2-earnings-on-trade-talk-prospects,Positive,6 Tech Stocks to Buy Pre Q2 Earnings on Trade Talk Prospects,Zacks Investment Research,0
2019-07-24 11:24:00-04:00,PYPL,paypal spurs scale efficiency venmo monetization paypal remains bullish international markets looks tap trillion total addressable market opportunity across payments,PayPal remains bullish on the international markets and looks to tap the $110 trillion total addressable market opportunity across payments.,https://seekingalpha.com/article/4277050-paypal-spurs-scale-efficiency-venmo-monetization?source=feed_tag_long_ideas,Neutral,PayPal Spurs Scale Efficiency Through Venmo Monetization,Seeking Alpha,0
2019-07-24 11:57:16-04:00,PYPL,paypal earnings watch estimates exclude big investment gain consensus estimates paypal earnings appear low heading second quarter report due big gain equity investments post paypal earnings watch estimates exclude big investment gain appeared first investor business daily,"Consensus estimates for PayPal earnings appear low heading into its second-quarter report due to a big gain on equity investments. 
The post PayPal Earnings Watch: Estimates Exclude Big Investment Gain appeared first on Investor's Business Daily.",https://www.investors.com/news/technology/paypal-earnings-estimates-low-pypl-stock-watch/,Neutral,PayPal Earnings Watch: Estimates Exclude Big Investment Gain,Investors Business Daily,0
2019-07-24 16:30:02-04:00,PYPL,paypal falls sales miss lower guidance paypal holdings inc nasdaq pypl shares dropping reporting second quarter sales miss,PayPal Holdings Inc (NASDAQ: PYPL) shares are dropping after reporting a second-quarter sales miss.,https://www.benzinga.com/news/earnings/19/07/14128666/paypal-falls-on-q2-sales-miss-lower-guidance,Negative,"PayPal Falls On Q2 Sales Miss, Lower Guidance",Benzinga,0
2019-07-24 16:34:50-04:00,PYPL,earnings results paypal stock falls lowered revenue outlook trumps earnings beat paypal holdings inc reported better expected second quarter profit wednesday even accounting investment benefits shares fell hours trading company lowered full year revenue outlook,"PayPal Holdings Inc. reported better-than-expected second quarter profit Wednesday, even after accounting for investment benefits, but shares fell in after-hours trading after the company lowered its full-year revenue outlook.",https://www.marketwatch.com/story/paypal-stock-falls-after-lowered-revenue-outlook-trumps-earnings-beat-2019-07-24,Negative,Earnings Results: PayPal stock falls after lowered revenue outlook trumps earnings beat,Market Watch,0
2019-07-24 16:39:31-04:00,PYPL,paypal reports revenue shy expectations pushes full year revenue guidance cnbc deirdre bosa joins closing bell report latest paypal earnings report,"CNBC's Deirdre Bosa joins ""Closing Bell"" to report the latest from PayPal's earnings report.",https://www.youtube.com/watch?v=xD3AgWdkWtA,Negative,"PayPal reports revenue shy of expectations, pushes down full-year revenue guidance",CNBC Television,0
