time,symbol,text,raw_text,url,src_sentiment,raw_title,source_name,sentiment
2018-02-05 19:00:00-05:00,PYPL,paypal co founder max levchin gender diversity silicon valley affirm ceo max levchin co founder paypal discusses experience gender diversity silicon valley speaks emily chang bloomberg technology,"Affirm CEO Max Levchin, a co-founder of PayPal, discusses his experience with gender diversity in Silicon Valley. He speaks with Emily Chang on Bloomberg Technology.",https://www.youtube.com/watch?v=KNgeNUA3J1Q,Neutral,PayPal Co-Founder Max Levchin on Gender Diversity in Silicon Valley,Bloomberg Technology,0
2018-03-14 20:00:00-04:00,PYPL,paypal ceo digitization cash mad money paypal added verb english language venmo innovator cashless society keep capitalizing digital dependence jim cramer asked bankable ceo,"PayPal added a verb to the English language - as in, ""Just Venmo me"". Will this innovator of a cashless society keep capitalizing on our digital dependence? Jim Cramer asked its bankable CEO.",https://www.youtube.com/watch?v=EmnOVfTXIHI,Neutral,PayPal CEO: Digitization Of Cash | Mad Money,CNBC,0
2018-04-08 20:00:00-04:00,PYPL,reports paypal getting traditional banking win consumers fbn kristina partsinevelos reports paypal may enter traditional banking sector,FBN's Kristina Partsinevelos on reports PayPal may enter the traditional banking sector.,https://www.youtube.com/watch?v=cRL5kF_lscE,Neutral,Reports of PayPal getting into traditional banking a win for consumers?,Fox Business,0
2018-04-23 20:00:00-04:00,PYPL,hottest earnings charts week eyes hot stocks busy earnings week,All eyes will be on these hot stocks during this busy earnings week.,https://www.youtube.com/watch?v=3L5MNmTV0cA,Neutral,The Hottest Earnings Charts This Week,Zacks Investment Research,0
2018-04-24 20:00:00-04:00,PYPL,paypal holds losing ebay bloomberg julie verhage reports paypal first quarter results optimistic forecast bloomberg technology,Bloomberg's Julie Verhage reports on PayPal's first-quarter results and optimistic forecast on Bloomberg Technology.,https://www.youtube.com/watch?v=nhiS4mcHgEA,Neutral,PayPal Holds Its Own After Losing EBay,Bloomberg Technology,0
2018-04-25 20:00:00-04:00,PYPL,paypal cfo growth competition barclays partnership john rainey chief financial officer paypal discusses first quarter results company new payment partnership barclays speaks bloomberg markets european close,"John Rainey, chief financial officer at PayPal, discusses first-quarter results and the company's new payment partnership with Barclays. He speaks on Bloomberg Markets: European Close.",https://www.youtube.com/watch?v=vUXlj2MqEbo,Neutral,"PayPal CFO on Growth, Competition, Barclays Partnership",Bloomberg Technology,0
2018-05-03 20:00:00-04:00,PYPL,jim cramer tariffs jobs report fluor norwegian cruise line thestreet founder action alerts plus portfolio manager jim cramer weighs friday trending market topics including tariffs jobs report fluor norwegian cruise line,"TheStreet's founder and Action Alerts PLUS Portfolio Manager Jim Cramer weighs in on Friday's trending market topics, including tariffs, jobs report, Fluor and Norwegian Cruise Line.",https://www.youtube.com/watch?v=-TZItcFfnxQ,Neutral,"Jim Cramer on Tariffs, Jobs Report, Fluor and Norwegian Cruise Line",The Street,0
2018-05-06 20:00:00-04:00,PYPL,jim cramer warren buffett apple mcdonald yum brands paypal thestreet founder action alerts plus portfolio manager jim cramer weighs monday trending market topics including berkshire hathaway ceo warren buffett comments apple along goldman sachs note mcdonald outlook yum brands cramer interview paypal ceo dan schulman,"TheStreet's founder and Action Alerts PLUS Portfolio Manager Jim Cramer weighs in on Monday's trending market topics including Berkshire Hathaway CEO Warren Buffett's comments on Apple, along with a Goldman Sachs note on McDonald's, the outlook for Yum! Brands and Cramer's interview with PayPal CEO Dan Schulman.",https://www.youtube.com/watch?v=Zbykz-M_qoE,Neutral,"Jim Cramer on Warren Buffett, Apple, McDonald's, Yum! Brands and PayPal",The Street,0
2018-05-15 20:00:00-04:00,PYPL,jim cramer macy micron cbre welbilt paypal thestreet founder action alerts plus portfolio manager jim cramer weighs wednesday trending stocks floor new york stock exchange including macy micron cbre group welbilt paypal,"TheStreet's founder and Action Alerts PLUS Portfolio Manager Jim Cramer weighs in on Wednesday's trending stocks from the floor of the New York Stock Exchange including Macy's, Micron, CBRE Group, Welbilt and PayPal.",https://www.youtube.com/watch?v=QkbcUZjptAw,Neutral,"Jim Cramer on Macy's, Micron, CBRE, Welbilt and PayPal",The Street,0
2018-05-16 20:00:00-04:00,PYPL,jim cramer cisco walmart world wrestling entertainment paypal thestreet founder action alerts plus portfolio manager jim cramer weighs thursday trending stocks floor new york stock exchange including cisco walmart world wide wrestling entertainment paypal square,"TheStreet's founder and Action Alerts PLUS Portfolio Manager Jim Cramer weighs in on Thursday's trending stocks from the floor of the New York Stock Exchange, including Cisco, Walmart, World Wide Wrestling Entertainment, PayPal and Square.",https://www.youtube.com/watch?v=bJSSsZIWPxE,Neutral,"Jim Cramer on Cisco, Walmart, World Wrestling Entertainment and PayPal",Fox Business,0
2018-05-20 20:00:00-04:00,PYPL,paypal cfo democratizing financial services monthly downloads square cash app picking pace paypal keeping competition bay jim cramer sits cfo john rainey find,"Monthly downloads of Square's cash app are picking up the pace, so how is PayPal keeping the competition at bay? Jim Cramer sits with its CFO, John Rainey, to find out.",https://www.youtube.com/watch?v=iBmNs9yKYD4,Neutral,PayPal CFO: Democratizing Financial Services,CNBC,0
2018-05-23 20:00:00-04:00,PYPL,jim cramer north korea oil prices apple carnival corporation thestreet founder action alerts plus portfolio manager jim cramer weighs thursday trending market topics floor new york stock exchange including president trump move cancel north korea summit retreat oil prices apple services revenue growth may buying opportunity carnival corporation,"TheStreet's founder and Action Alerts PLUS Portfolio Manager Jim Cramer weighs in on Thursday's trending market topics from the floor of the New York Stock Exchange, including President's Trump's move to cancel the North Korea summit, the retreat in oil prices, Apple's services revenue growth and why there may be a buying opportunity in Carnival Corporation.",https://www.youtube.com/watch?v=Nr0DWvi5ebU,Neutral,"Jim Cramer on North Korea, Oil Prices, Apple and Carnival Corporation",The Street,0
2018-06-21 20:00:00-04:00,PYPL,right ceo netflix stock ceo randall stephenson came bullish future tv wells fargo conference thursday makes sense light mega deal time warner netflix shares hovering around time high suggests stephenson temper enthusiasm,"AT&T's CEO Randall Stephenson came out very bullish on the future of TV at a Wells Fargo conference on Thursday. Makes sense in light of his mega deal for Time Warner. But, Netflix shares hovering around an all-time high suggests Stephenson should temper his enthusiasm.",https://www.youtube.com/watch?v=7vyuJhN5zOk,Neutral,Who's Right: AT&T's CEO or Netflix Stock?,The Street,0
2018-07-09 20:00:00-04:00,PYPL,paypal potential grow globally halo investing ceo halo investing ceo biju kulathakal predicts paypal acquisitions next years help company grow globally move investments trading aspects,"Halo Investing CEO Biju Kulathakal predicts that PayPal's acquisitions over the next few years will help the company grow globally and move in to investments, trading, and other aspects.",https://www.youtube.com/watch?v=ZNBqQx7TAcY,Neutral,PayPal has potential to grow globally: Halo Investing CEO,Fox Business,0
2018-07-10 20:00:00-04:00,PYPL,buy payments stocks rated analyst lisa ellis moffettnathanson payments analyst rated institutional investor discusses top picks comes payments stocks,"Lisa Ellis, MoffettNathanson payments analyst rated no. 1 by Institutional Investor, discusses her top picks when it comes to payments stocks.",https://www.youtube.com/watch?v=rtlFPuQIB2k,Neutral,Buy these payments stocks: No.1 rated analyst,CNBC Television,0
2018-07-22 20:00:00-04:00,PYPL,fabulous earnings charts hottest tech stocks hot year five big technology names looking soar even greater heights earnings season,"They've been hot all year, and now these five big technology names are looking to soar to even greater heights this earnings season.",https://www.youtube.com/watch?v=f_YcSdhN4MY,Neutral,The Fabulous Earnings Charts of the 5 Hottest Tech Stocks,Zacks Investment Research,0
2018-07-22 20:00:00-04:00,PYPL,hasbro halliburton utilities third point new paypal stake bltiz halftime report traders ubs erin browne give investors trades monday big movers,"The ""Halftime Report"" traders and UBS' Erin Browne give investors the trades on Monday's big movers.",https://www.youtube.com/watch?v=ewU_9uDulOE,Neutral,"Hasbro, Halliburton, utilities and Third Point's new PayPal stake in the bltiz",CNBC Television,0
2018-07-22 20:00:00-04:00,PYPL,third point paypal could next netflix amazon cnbc dominic chu reports dan loeb third point capital disclosing new stake paypal,CNBC's Dominic Chu reports on Dan Loeb's Third Point Capital disclosing a new stake in Paypal.,https://www.youtube.com/watch?v=e8-l2yZkJuM,Neutral,Third Point: Paypal could be the next Netflix or Amazon,CNBC Television,0
2018-07-24 20:00:00-04:00,PYPL,boeing weighs dow grubhub irobot jump earnings paypal set report investor business daily new report,Investor´s Business Daily´s new Report,https://www.youtube.com/watch?v=k_HTCbMfE_M,Neutral,"Boeing weighs on Dow; Grubhub, iRobot jump on earnings; PayPal set to report",Investors Business Daily,0
2018-07-25 20:00:00-04:00,PYPL,paypal falls revenue guidance cnbc aditi roy reports latest paypal quarterly earnings,CNBC's Aditi Roy reports the latest on Paypal's quarterly earnings.,https://www.youtube.com/watch?v=r3I_Q_WmEII,Neutral,Paypal falls on Q3 revenue guidance,CNBC Television,0
2018-07-30 20:00:00-04:00,PYPL,questions halftime traders either gang weighs,Either or? The gang weighs in.,https://www.youtube.com/watch?v=JkhmmFfrLdk,Neutral,Your questions for the Halftime traders,CNBC Television,0
2018-07-31 20:00:00-04:00,PYPL,bulls sip campbell soup plus options market saying microsoft halftime report traders jon pete najarian spot unusual options activity shares campbell soup johnson controls microsoft paypal,"""Halftime Report"" traders Jon and Pete Najarian spot unusual options activity in shares of Campbell Soup, Johnson Controls, Microsoft, and PayPal.",https://www.youtube.com/watch?v=vPyvfHjdbtY,Neutral,"Bulls sip on Campbell Soup. Plus, what the options market is saying about Microsoft",CNBC Television,0
2018-08-01 20:00:00-04:00,PYPL,final trade pypl sq fast money traders share final trades day including paypal cbs square celgene,"The ""Fast Money"" traders share their final trades of the day, including PayPal, CBS, Square and Celgene.",https://www.youtube.com/watch?v=I_vDh3j4H3U,Neutral,"Final Trade: PYPL, SQ & more",CNBC Television,0
2018-08-15 20:00:00-04:00,PYPL,stocks billionaires george soros warren buffett buying fbn kristina partsinevelos discusses stocks billionaires george soros warren buffett buying,FBN's Kristina Partsinevelos discusses what stocks billionaires George Soros and Warren Buffett are buying.,https://www.youtube.com/watch?v=lXIz4O44U6g,Neutral,"What stocks are billionaires George Soros, Warren Buffett buying?",Fox Business,0
2018-08-21 20:00:00-04:00,PYPL,netflix hit new highs foot locker buy ahead earnings plus trade paypal halftime report traders answer viewer questions paypal foot locker netflix,"The ""Halftime Report"" traders answer viewer questions on PayPal, Foot Locker, and Netflix.",https://www.youtube.com/watch?v=v3exjECVQ1o,Neutral,"When will Netflix hit new highs? Is Foot Locker a buy ahead of earnings? Plus, the trade on PayPal",CNBC Television,0
2018-08-23 20:00:00-04:00,PYPL,around federal reserve chairman jerome powell could slap markets jackson hole pay attention slow summer friday investors,"Pay attention on this slow summer Friday, investors.",https://www.youtube.com/watch?v=zyErQhEMrFk,Neutral,Around Federal Reserve Chairman Jerome Powell Could Slap Markets At Jackson Hole,The Street,0
2018-08-27 20:00:00-04:00,PYPL,final trades gilead paypal rh delta flir halftime report traders give top stocks watch second half,"The ""Halftime Report"" traders give their top stocks to watch for the second half.",https://www.youtube.com/watch?v=fZpBRHIptSU,Neutral,"Final Trades: Gilead, Paypal, RH, Delta and FLIR",CNBC Television,0
2018-08-29 20:00:00-04:00,PYPL,final trade lulu pvh pypl fast money traders share final trades day including lululemon pvh paypal,"The ""Fast Money"" traders share their final trades of the day, including Lululemon, PVH and PayPal",https://www.youtube.com/watch?v=O0zkW9endo4,Neutral,"Final Trade: LULU, PVH & PYPL",CNBC Television,0
2018-08-29 20:00:00-04:00,PYPL,earnings winners losers blitz halftime report traders take investors day biggest movers,"The ""Halftime Report"" traders take investors through some of the day's biggest movers.",https://www.youtube.com/watch?v=q5cZgPCEEHc,Neutral,Earnings winners...and losers in the blitz,CNBC Television,0
2018-09-04 20:00:00-04:00,PYPL,final trade pypl tgt fast money traders share final trades day including paypal target twitter kroger,"The ""Fast Money"" traders share their final trades of the day, including PayPal, Target, Twitter and Kroger.",https://www.youtube.com/watch?v=t46hTeNrEwc,Neutral,"Final Trade: PYPL, TGT & more",CNBC Television,0
2018-09-13 20:00:00-04:00,PYPL,freeport mcmoran buy square best bet fintech halftime report traders take viewer questions askhalftime,"The ""Halftime Report"" traders take viewer questions in #AskHalftime",https://www.youtube.com/watch?v=ZH0hE8hyt4I,Neutral,Is Freeport-McMoRan a buy? Is Square the best bet in fintech & more,CNBC Television,0
2018-09-20 20:00:00-04:00,PYPL,paypal bans infowars promoting hate cnbc dominic chu reports payment platform paypal banned alex jones infowars,CNBC's Dominic Chu reports that payment platform PayPal has banned Alex Jones' InfoWars.,https://www.youtube.com/watch?v=3bhvQm19nhc,Neutral,PayPal bans InfoWars for 'promoting hate',CNBC Television,0
2018-10-07 20:00:00-04:00,PYPL,final trades etp dis fast money traders share final trades day including energy transfer partners disney paypal bristol myers squibb,"The ""Fast Money"" traders share their final trades of the day, including Energy Transfer Partners, Disney, PayPal and Bristol-Myers Squibb",https://www.youtube.com/watch?v=jcNwEt87O1c,Neutral,"Final Trades: ETP, DIS & more",CNBC Television,0
2018-10-16 20:00:00-04:00,PYPL,options traders bet surging emerging market halftime report traders jon pete najarian spot unusual options activity shares brazil etf paypal nokia,"""Halftime Report"" traders Jon and Pete Najarian spot unusual options activity in shares of BRazil ETF, Paypal and Nokia.",https://www.youtube.com/watch?v=3VT-fmNIH64,Neutral,Options traders bet on this surging emerging market,CNBC Television,0
2018-10-17 20:00:00-04:00,PYPL,paypal beats revenue estimates cnbc deirdre bosa reports paypal beat revenue estimates,CNBC's Deirdre Bosa reports that PayPal beat revenue estimates.,https://www.youtube.com/watch?v=iNUdIvECT9M,Neutral,PayPal beats revenue estimates,CNBC Television,0
2018-10-17 20:00:00-04:00,PYPL,breaking paypal earnings report lisa ellis moffett nathanson breaks paypal earnings results,Lisa Ellis of Moffett Nathanson breaks down PayPal's earnings results.,https://www.youtube.com/watch?v=A3Ym57yq1r8,Neutral,Breaking down PayPal's Q3 earnings report,CNBC Television,0
2018-10-18 20:00:00-04:00,PYPL,procter gamble amex lead dow higher paypal reports strong growth ken shreve elaine low analyses stock behavior,Ken Shreve & Elaine Low´s analyses stock´s behavior..,https://www.youtube.com/watch?v=-jP4ueHK9ng,Neutral,"Procter & Gamble, AmEx Lead Dow Higher; PayPal Reports Strong Growth",CNBC Television,0
2018-10-18 20:00:00-04:00,PYPL,looks like millennials money get american express card says cramer cnbc squawk street team discusses markets ahead market open,CNBC's 'Squawk on the Street' team discusses markets ahead of the market open,https://www.youtube.com/watch?v=A7mFnFmXqxI,Neutral,"Looks like when millennials have some money, they get an American Express card, says Cramer",CNBC Television,0
2018-10-18 20:00:00-04:00,PYPL,final trades china tech crown castle allergan verizon halftime report traders give top stocks watch second half,"The ""Halftime Report"" traders give their top stocks to watch for the second half.",https://www.youtube.com/watch?v=Hvz6I8Ista8,Neutral,"Final Trades: China tech, Crown Castle, Allergan & Verizon",CNBC Television,0
2018-10-22 20:00:00-04:00,PYPL,sifting earnings wreckage navigating earnings chaos cnbc dominic chu melissa lee fast money traders pete najarian tim seymour dan nathan guy adami,"Navigating the earnings chaos, with CNBC's Dominic Chu and Melissa Lee, and the Fast Money traders, Pete Najarian, Tim Seymour, Dan Nathan and Guy Adami.",https://www.youtube.com/watch?v=tEuPhsOpydQ,Neutral,Sifting through the earnings wreckage,CNBC Television,0
2018-10-22 20:00:00-04:00,PYPL,final trades fdc intc fast money traders share final trades day including first data corp intel paypal dunkin brands,"The ""Fast Money"" traders share their final trades of the day, including First Data Corp., Intel, PayPal and Dunkin' Brands.",https://www.youtube.com/watch?v=bR5NMwnHmmM,Neutral,"Final Trades: FDC, INTC & more",CNBC Television,0
2018-10-24 20:00:00-04:00,PYPL,paypal cfo inflection point mad money cnbc paypal latest quarter vindicated bulls innovator cashless society keep capitalizing digital dependence jim cramer checks cfo earnings,PayPal's latest quarter just vindicated the bulls. But can this innovator of a cashless society keep capitalizing on our digital dependence? Jim Cramer checks in with the CFO after earnings.,https://www.youtube.com/watch?v=Rh0uRaQRwwo,Neutral,PayPal CFO: Inflection Point | Mad Money | CNBC,CNBC Television,0
2018-10-25 20:00:00-04:00,PYPL,bright spots amid tech wreck tech sector sells overall market cnbc frank holland reports names bucking trend,"As most of the tech sector sells off with the overall market, CNBC's Frank Holland reports on which names are bucking the trend.",https://www.youtube.com/watch?v=RLE1jk9IRWY,Neutral,Bright spots amid the tech wreck,CNBC Television,0
2018-10-28 20:00:00-04:00,PYPL,final trades paypal mastercard metlife buying retest halftime report traders give top stocks watch second half,"The ""Halftime Report"" traders give their top stocks to watch for the second half.",https://www.youtube.com/watch?v=5mXkeFAfyHM,Neutral,"Final Trades: PayPal, Mastercard, Metlife and buying the retest",CNBC Television,0
2018-11-05 19:00:00-05:00,PYPL,square upgraded buy citi traders joe terranova stephanie link josh brown jon najarian joined tom lee head research fundstrat global advisors discuss citi upgrade square buy,"Traders Joe Terranova, Stephanie Link, Josh Brown and Jon Najarian are joined by Tom Lee, head of research at Fundstrat Global Advisors, to discuss Citi's upgrade of Square to buy.",https://www.youtube.com/watch?v=JhfVHIgbEdQ,Neutral,Square upgraded to buy at Citi,CNBC Television,0
2018-11-18 19:00:00-05:00,PYPL,unusual options activity paypal telecom giant halftime report traders jon pete najarian spot unusual options activity shares paypal verizon,"""Halftime Report"" traders Jon and Pete Najarian spot unusual options activity in shares of PayPal & Verizon.",https://www.youtube.com/watch?v=U3wqA6KzZeU,Neutral,Unusual options activity in Paypal and this telecom giant,CNBC Television,0
2018-11-19 19:00:00-05:00,PYPL,final trades pypl ko fast money traders share final trades day including paypal coca cola valero,"The ""Fast Money"" traders share their final trades of the day, including PayPal, Coca-Cola and Valero.",https://www.youtube.com/watch?v=nl_mvfB4HOg,Neutral,"Final Trades: PYPL, KO & more",CNBC Television,-1
2018-11-20 19:00:00-05:00,PYPL,paypal buy time sell cabot oil questions askhalftime halftime report traders answer viewer questions,"The ""Halftime Report"" traders answer viewer questions.",https://www.youtube.com/watch?v=dRlSw2RDOak,Neutral,Is PayPal a buy? Time to sell Cabot Oil? Those questions and more in #AskHalftime,CNBC Television,0
2018-11-29 19:00:00-05:00,PYPL,open platform conscious shift paypal strategy says bill ready conscious shift paypal strategy move open platform partners others ecosystem paypal coo bill ready told ibd,"It was a ""conscious shift"" in PayPal's strategy to move to an open platform that partners up with others in the ecosystem, PayPal COO Bill Ready told IBD.",https://www.youtube.com/watch?v=2domfQzzWC8,Neutral,"Open Platform A 'Conscious Shift' In PayPal Strategy, Says Bill Ready",Investors Business Daily,0
2018-12-03 19:00:00-05:00,PYPL,paypal coo engaging productively uk regulator izettle deal squawk box europe bill ready discusses paypal billion izettle acquisition whether room deals fintech giant,Bill Ready discusses PayPal's $2.2 billion iZettle acquisition and whether there's room for more deals for the fintech giant.,https://www.youtube.com/watch?v=tsa-apcCh3k,Neutral,PayPal COO: Engaging productively with UK regulator on iZettle deal | Squawk Box Europe,CNBC International TV,0
2018-12-12 11:51:07-05:00,PYPL,credit services companies trade sideways market mean trading opportunities profit using range bound strategies trade three credit services stocks,A sideways market doesn't mean there are no trading opportunities. Profit using range-bound strategies to trade three credit services stocks.,https://www.investopedia.com/3-credit-services-companies-to-trade-4580418,Positive,3 Credit Services Companies to Trade,Investopedia,0
2018-12-16 19:00:00-05:00,PYPL,top stock picks week december two tech stocks providing solutions,Two Tech Stocks Providing Solutions.,https://www.youtube.com/watch?v=tSFH19hK06g,Neutral,Top Stock Picks for the Week of December 17th,Zacks Investment Research,0
2018-12-26 19:00:00-05:00,PYPL,stocks pull back huge rally paypal workday starbucks acting well ed carson market update,Ed Carson´s Market Update,https://www.youtube.com/watch?v=g3TLaMbyzgo,Neutral,"Stocks pull back after huge rally; PayPal, Workday, Starbucks acting well",Investors Business Daily,1
2019-01-03 19:00:00-05:00,PYPL,stocks rebound helped strong december jobs report elaine low ken shrive market update,Elaine Low & Ken Shrive´s Market Update,https://www.youtube.com/watch?v=bOGNQoOlldU,Neutral,"Stocks Rebound, Helped By Strong December Jobs Report",Investors Business Daily,0
2019-01-06 19:00:00-05:00,PYPL,chart master carter worth says best stocks buy matter cornerstone macro carter worth gives three stocks buy matter happens cnbc melissa lee fast money traders tim seymour karen finerman steve grasso guy adami,"Cornerstone Macro's Carter Worth gives three stocks to buy no matter what happens. With CNBC's Melissa Lee and the Fast Money traders, Tim Seymour, Karen Finerman, Steve Grasso and Guy Adami.",https://www.youtube.com/watch?v=mmSVaEWhzNM,Neutral,Chart master Carter Worth says these are the best 3 stocks to buy no matter what,CNBC Television,0
2019-01-08 19:00:00-05:00,PYPL,final trades uso mdrx pypl vcr xly halftime report traders give top stocks watch second half,"The ""Halftime Report"" traders give their top stocks to watch for the second half.",https://www.youtube.com/watch?v=SUZ7GysMtzE,Neutral,"Final Trades: USO, MDRX, PYPL, VCR & XLY",CNBC Television,0
2019-01-14 19:00:00-05:00,PYPL,final trades pepsi jpmorgan groupon paypal halftime report traders give top stocks watch second half,"The ""Halftime Report"" traders give their top stocks to watch for the second half.",https://www.youtube.com/watch?v=vdA5sjUid-Q,Neutral,"Final trades: Pepsi, JPMorgan, Groupon & PayPal",CNBC Television,0
2019-01-14 19:00:00-05:00,PYPL,final trades unitedhealth first republic bank vmware paypal morgan stanley halftime report traders give stop stocks watch second half,"The ""Halftime Report"" traders give their stop stocks to watch for the second half.",https://www.youtube.com/watch?v=8Jnh8rvMsN4,Neutral,"Final trades: UnitedHealth, First Republic Bank, VMWare, Paypal & Morgan Stanley",CNBC Television,0
2019-01-16 19:00:00-05:00,PYPL,questions answered defense energy tech stocks askhalftime halftime report traders answer viewer questions raytheon exxon mobil akamai paypal,"The ""Halftime Report"" traders answer viewer questions on Raytheon, Exxon Mobil, Akamai, and PayPal.",https://www.youtube.com/watch?v=xZfgikiibQ8,Neutral,"Your questions answered on defense, energy, and tech stocks. #AskHalftime",CNBC Television,0
2019-01-16 19:00:00-05:00,PYPL,picking payment stocks trades fast money traders give trades payment space billion deal takes aim paypal square,"The ""Fast Money"" traders give you 5 trades in the payment space as a $22 billion deal takes aim at Paypal and Square.",https://www.youtube.com/watch?v=zO1B6qV0ypw,Neutral,Picking payment stocks: 4 trades,CNBC Television,0
2019-01-21 19:00:00-05:00,PYPL,paypal mastercard execs see huge opportunity partnerships cnbc elizabeth schulze hosts panel paypal coo bill ready mastercard vice chairman ann cairns funding circle ceo samir desai,"CNBC's Elizabeth Schulze hosts a panel with PayPal COO Bill Ready, Mastercard Vice Chairman Ann Cairns and Funding Circle CEO Samir Desai.",https://www.youtube.com/watch?v=CTKUwKpQ4Yc,Neutral,"PayPal, Mastercard execs see 'huge opportunity' in partnerships",CNBC International TV,0
