time,symbol,text,raw_text,url,src_sentiment,raw_title,source_name,sentiment
2020-02-19 13:14:46-05:00,PYPL,megatrend synergies assures long term upside paypal stock paypal stock soared impressive metrics recent earnings report based convergence multiple megatrends pypl bullish narrative beginning,"PayPal stock has soared off impressive metrics from its recent earnings report. But based on the convergence of multiple megatrends, PYPL’s bullish narrative is only just beginning.",https://investorplace.com/2020/02/megatrend-synergies-assures-long-term-upside-for-paypal-stock/,Positive,Megatrend Synergies Assures Long-Term Upside for PayPal Stock,InvestorPlace,0
2020-02-19 14:09:19-05:00,PYPL,investors buy paypal stock long term investors buy paypal stock weakness company multiple strong positive growth catalysts post investors buy paypal stock,"Long-term investors should buy PayPal stock on weakness because the company has multiple, strong, positive growth catalysts. 
The post Should Investors Buy PayPal Stock?",https://investorplace.com/2020/02/should-investors-buy-paypal-stock/,Neutral,Should Investors Buy PayPal Stock?,InvestorPlace,0
2020-02-20 11:13:11-05:00,PYPL,charts show visa mastercard paypal room run jim cramer says cnbc jim cramer examined stock charts visa mastercard american express paypal determine whether payment processors could see additional moves upside,"CNBC's Jim Cramer examined the stock charts of Visa, Mastercard, American Express and PayPal to determine whether the payment processors could see additional moves to the upside.",https://www.youtube.com/watch?v=X3XwNnzvkQ0,Positive,"Charts show Visa, Mastercard and PayPal have more room to run, Jim Cramer says",CNBC Television,0
2020-02-25 10:10:00-05:00,PYPL,stocks buy worried recession three companies growth opportunities balance sheet make economic downturn,These three companies have the growth opportunities and balance sheet to make it through an economic downturn.,https://www.fool.com/investing/2020/02/25/3-stocks-to-buy-if-youre-worried-about-a-recession.aspx,Positive,3 Stocks to Buy if You’re Worried About a Recession,The Motley Fool,-1
2020-02-27 08:49:14-05:00,PYPL,paypal expects coronavirus negatively impact revenue percentage point paypal holdings inc pypl expects coronavirus negative revenue impact percentage point march quarter company disclosed release thursday morning,"PayPal Holdings Inc. PYPL, -0.50% expects the coronavirus to have a negative revenue impact of 1 percentage point for the March quarter, the company disclosed in a release Thursday morning.",https://www.marketwatch.com/story/paypal-expects-coronavirus-to-negatively-impact-revenue-by-1-percentage-point-2020-02-27,Negative,PayPal expects coronavirus to negatively impact revenue by 1 percentage point,Market Watch,0
2020-02-27 08:56:51-05:00,PYPL,paypal warns coronavirus negative impact revenue expectations quarter paypal reduced first quarter revenue guidance percentage point,PayPal reduced its first quarter revenue guidance by a percentage point.,https://www.cnbc.com/2020/02/27/paypal-warns-coronavirus-will-have-a-negative-impact-on-q1-revenue.html,Negative,PayPal warns coronavirus will have a negative impact on revenue expectations for the quarter,CNBC,0
2020-02-27 10:59:05-05:00,PYPL,paypal stock falls china coronavirus warning global e commerce paypal warned thursday rapidly spreading china coronavirus impact global e commerce activity lowered march quarter revenue forecast paypal stock slipped news,"PayPal warned Thursday the rapidly spreading China coronavirus will impact global e-commerce activity, and lowered its March quarter revenue forecast. PayPal stock slipped on the news.",https://www.investors.com/news/technology/paypal-stock-falls-warning-china-coronavirus/,Negative,PayPal Stock Falls On China Coronavirus Warning For Global E-Commerce,Investors Business Daily,0
2020-02-28 10:15:00-05:00,PYPL,better buy paypal holdings vs square looking fintech stock let profit war cash companies probably short list,"If you're looking for a fintech stock that will let you profit from the war on cash, both of these companies are probably on your short list.",https://www.fool.com/investing/2020/02/28/better-buy-paypal-holdings-vs-square.aspx,Neutral,Better Buy:  PayPal Holdings vs.  Square,The Motley Fool,0
2020-02-28 11:31:11-05:00,PYPL,paypal pypl since last earnings report rebound paypal pypl reported earnings days ago next stock,Paypal (PYPL) reported earnings 30 days ago. What's next for the stock?,http://www.zacks.com/stock/news/788743/paypal-pypl-down-79-since-last-earnings-report-can-it-rebound,Negative,Paypal (PYPL) Down 7.9% Since Last Earnings Report: Can It Rebound?,Zacks Investment Research,0
2020-03-02 10:38:00-05:00,PYPL,paypal stock shows improvement technical measurement paypal shows improving price performance earning upgrade ibd relative strength rating post paypal stock shows improvement technical measurement appeared first investor business daily,"PayPal shows improving price performance, earning an upgrade to its IBD Relative Strength Rating.
The post PayPal Stock Shows Improvement In Technical Measurement appeared first on Investor's Business Daily.",https://www.investors.com/news/technology/stocks-showing-improved-relative-strength-paypal/,Positive,PayPal Stock Shows Improvement In Technical Measurement,Investors Business Daily,0
2020-03-02 16:12:00-05:00,PYPL,etfs play dow slid last week spike number infected cases outside mainland china made coronavirus outbreak serious threat global economic growth corporate earnings,The spike in the number of infected cases outside mainland China has made the coronavirus outbreak a serious threat to global economic growth and corporate earnings.,http://www.zacks.com/stock/news/793197/etfs-to-play-as-dow-slid-12-last-week,Positive,ETFs to Play as Dow Slid 12% Last Week,Zacks Investment Research,0
2020-03-03 07:53:06-05:00,PYPL,dwek valuations much attractive today plenty sectors like tech going appealing esty dwek natixis investment managers solutions kari firestone aureus asset management discuss markets massive bounce back whether could volatility ahead sectors stocks offer good opportunities investors,"Esty Dwek of Natixis Investment Managers Solutions and Kari Firestone of Aureus Asset Management discuss the markets' massive bounce-back, whether there could be more volatility ahead, and what sectors and stocks offer good opportunities for investors now.",https://www.youtube.com/watch?v=5IvfUf7NZyw,Positive,"Dwek: Valuations are much more attractive today, and plenty of sectors like tech are going to be appealing",CNBC Television,0
2020-03-04 07:45:00-05:00,PYPL,top fintech stocks buy march list financial technology stocks bought novel coronavirus selloff,"Here is the list of financial technology stocks I bought during the novel coronavirus selloff, and why.",https://www.fool.com/investing/2020/03/04/4-top-fintech-stocks-to-buy-in-march.aspx,Positive,4 Top Fintech Stocks to Buy in March,The Motley Fool,0
2020-03-06 17:45:21-05:00,PYPL,paypal pypl stock moves know paypal pypl closed latest trading session marking move prior day,"Paypal (PYPL) closed at $110.91 in the latest trading session, marking a -1.13% move from the prior day.",http://www.zacks.com/stock/news/800693/paypal-pypl-stock-moves-113-what-you-should-know,Neutral,Paypal (PYPL) Stock Moves -1.13%: What You Should Know,Zacks Investment Research,0
2020-03-11 11:17:00-04:00,PYPL,paypal stock sees composite rating upgrade paypal stock saw ibd smartselect composite rating rise wednesday meaning outperforms stocks key measurements post paypal stock sees composite rating upgrade appeared first investor business daily,"PayPal stock saw its IBD SmartSelect Composite Rating rise to 97 Wednesday, up from 94, meaning it outperforms most stocks in key measurements.
The post PayPal Stock Sees Composite Rating Upgrade appeared first on Investor's Business Daily.",https://www.investors.com/news/technology/paypal-earns-ibd-stock-rating-upgrade/,Positive,PayPal Stock Sees Composite Rating Upgrade,Investors Business Daily,-1
2020-03-11 12:00:00-04:00,PYPL,paypal aspires reach billion users store payments path get,In-store payments will be its path to get there.,https://www.fool.com/investing/2020/03/11/paypal-aspires-to-reach-1-billion-users.aspx,Positive,PayPal Aspires to Reach 1 Billion Users,The Motley Fool,-1
2020-03-11 17:25:00-04:00,PYPL,u k tax revenues u tech giants alphabet facebook ebay amazon paypal sit squarely crosshairs,"Alphabet and Facebook, eBay, Amazon, and PayPal all sit squarely in the crosshairs.",https://www.fool.com/investing/2020/03/11/uk-to-tax-revenues-of-us-tech-giants.aspx,Negative,U.K. to Tax Revenues of U.S. Tech Giants,The Motley Fool,-1
2020-03-12 08:30:00-04:00,PYPL,better buy paypal holdings vs discover financial services deciding financial services company better investment numbers may point surprising results,"When deciding which financial services company is a better investment, the numbers may point to some surprising results.",https://www.fool.com/investing/2020/03/12/better-buy-paypal-holdings-vs-discover.aspx,Neutral,Better Buy: PayPal Holdings vs. Discover Financial Services,The Motley Fool,0
2020-03-12 09:28:00-04:00,PYPL,payment stocks feel heat coronavirus outbreak payment stocks display downtrend due global coronavirus pandemic,Payment stocks display a downtrend due to the global coronavirus pandemic.,http://www.zacks.com/stock/news/809414/payment-stocks-feel-the-heat-from-coronavirus-outbreak,Negative,Payment Stocks Feel the Heat From Coronavirus Outbreak,Zacks Investment Research,0
2020-03-13 11:24:00-04:00,PYPL,paypal stock rising friday payment processing giant rebounding nicely rough week,The payment processing giant is rebounding nicely after a rough week.,https://www.fool.com/investing/2020/03/13/heres-why-paypal-is-rising-on-friday.aspx,Positive,Here’s Why PayPal Stock Is Rising on Friday,The Motley Fool,0
2020-03-16 12:09:00-04:00,PYPL,paypal visa discover american express mastercard plunging monday payment processors pretty rough start week,The payment processors are having a pretty rough start to the week.,https://www.fool.com/investing/2020/03/16/heres-why-paypal-visa-discover-american-express-an.aspx,Negative,"Here's Why PayPal, Visa, Discover, American Express, and Mastercard Are Plunging on Monday",The Motley Fool,0
2020-03-17 09:51:00-04:00,PYPL,e commerce stocks gain coronavirus boosts online orders rapid spread coronavirus expected lower footfall physical stores boost online retailing tap e commerce stocks likely benefit including amzn ebay among others,"The rapid spread of coronavirus is expected to lower footfall in physical stores and boost online retailing. Tap e-commerce stocks that are likely to benefit including AMZN, EBAY among others.",http://www.zacks.com/stock/news/818439/6-e-commerce-stocks-to-gain-as-coronavirus-boosts-online-orders,Positive,6 E-commerce Stocks to Gain as Coronavirus Boosts Online Orders,Zacks Investment Research,0
2020-03-18 08:53:00-04:00,PYPL,paypal pypl looks good stock adds session paypal pypl saw big move last session shares jumped nearly day amid huge volumes,"PayPal (PYPL) saw a big move last session, as its shares jumped nearly 6% on the day, amid huge volumes.",http://www.zacks.com/stock/news/820523/paypal-pypl-looks-good-stock-adds-56-in-session,Positive,PayPal (PYPL) Looks Good: Stock Adds 5.6% in Session,Zacks Investment Research,0
2020-03-18 10:14:00-04:00,PYPL,fdic wants make new rules fintechs bank overseer seeks establish greater transparency accountability lender subsidiaries,The bank overseer seeks to establish greater transparency and accountability for lender subsidiaries.,https://www.fool.com/investing/2020/03/18/fdic-wants-to-make-new-rules-for-fintechs.aspx,Neutral,FDIC Wants to Make New Rules for Fintechs,The Motley Fool,0
2020-03-19 12:00:06-04:00,PYPL,paypal stock gains macquarie starts coverage high conviction outperform rating paypal holdings inc shares pypl thursday trading macquarie analyst dan dolev began coverage payments provider high conviction outperform rating target price,"PayPal Holdings Inc. shares PYPL, +2.91% are up 4.4% in Thursday trading after Macquarie analyst Dan Dolev began coverage of the payments provider with a ""high-conviction"" outperform rating and $112 target price.",https://www.marketwatch.com/story/guid/e5b7831a-7b38-4591-90d1-d336a28c3a99,Positive,PayPal stock gains after Macquarie starts coverage with a 'high-conviction' outperform rating,Market Watch,0
2020-03-20 08:52:02-04:00,PYPL,credit services stocks trading multi year support credit services stock may offset weaker consumer spending check three industry leaders,Here's how credit services stock may offset weaker consumer spending. Check out these three industry leaders.,https://www.investopedia.com/3-credit-services-stocks-trading-at-multi-year-support-4800415,Neutral,3 Credit Services Stocks Trading at Multi-Year Support,Investopedia,0
2020-03-21 09:59:00-04:00,PYPL,top coronavirus stocks buy right invest uncertain times,Here’s how to invest during these uncertain times.,https://www.fool.com/investing/2020/03/21/top-10-coronavirus-stocks-to-buy-right-now.aspx,Positive,Top 10 Coronavirus Stocks to Buy Right Now,The Motley Fool,0
2020-03-23 17:45:18-04:00,PYPL,paypal pypl stock moves know paypal pypl closed recent trading day moving previous trading session,"Paypal (PYPL) closed the most recent trading day at $85.26, moving -1.64% from the previous trading session.",http://www.zacks.com/stock/news/830563/paypal-pypl-stock-moves-164-what-you-should-know,Neutral,Paypal (PYPL) Stock Moves -1.64%: What You Should Know,Zacks Investment Research,1
2020-03-24 10:28:28-04:00,PYPL,digitialization payments makes paypal stock long term buy get winning side multiple megatrends buying pypl stock today market turmoil creates strong long term entry point post digitialization payments makes paypal stock long term buy appeared first investorplace,"Get on the winning side of multiple megatrends by buying PYPL stock, as today's market turmoil creates a strong long-term entry point.
The post Why the Digitialization of Payments Makes Paypal Stock a Long-Term Buy appeared first on InvestorPlace.",https://investorplace.com/2020/03/digitalization-payments-pypl-stock-long-term-buy/,Positive,Why the Digitialization of Payments Makes Paypal Stock a Long-Term Buy,InvestorPlace,1
2020-03-24 11:49:00-04:00,PYPL,stocks help stay afloat amid coronavirus crisis several stocks immune coronavirus impact fact likely keep gaining,"Several stocks are immune to coronavirus' impact and, in fact, are likely to keep gaining.",http://www.zacks.com/stock/news/832157/4-stocks-that-will-help-you-to-stay-afloat-amid-coronavirus-crisis,Positive,4 Stocks That Will Help You to Stay Afloat Amid Coronavirus Crisis,Zacks Investment Research,1
2020-03-24 16:05:00-04:00,PYPL,paypal stock soared tuesday tech stock surged stock market rebounded,The tech stock surged as the stock market rebounded.,https://www.fool.com/investing/2020/03/24/why-paypal-stock-soared-on-tuesday.aspx,Positive,Why PayPal Stock Soared on Tuesday,The Motley Fool,1
2020-03-27 10:52:15-04:00,PYPL,invest america trusted brands stocks buy research firm morning consult released trusted brands report seven brands stocks buy,Research firm Morning Consult just released its Most Trusted Brands 2020 report. Here’s why seven of these brands are stocks to buy.,https://investorplace.com/2020/03/invest-in-americas-most-trusted-brands-with-these-7-stocks-to-buy/,Positive,Invest in America’s Most Trusted Brands With These 7 Stocks to Buy,InvestorPlace,0
2020-03-27 19:40:37-04:00,PYPL,venmo cash app want deliver government stimulus payments online payment services like venmo cash app exploded popularity past years quite hit legitimacy threshold least eyes federal government checks direct deposit,"Online payment services like Venmo and Cash App have exploded in popularity over the past few years, but they haven't quite hit the legitimacy threshold, at least in the eyes of the federal government, of checks or direct deposit.",https://www.cnn.com/2020/03/27/tech/venmo-cash-app-stimulus/index.html,Neutral,Venmo and Cash App want to deliver government stimulus payments,CNN Business,0
2020-03-30 10:49:25-04:00,PYPL,best growth stocks april despite market turmoil shares paypal visa nike solaredge facebook could worth spot growth oriented portfolio,"Despite the market turmoil, shares of PayPal, Visa, Nike, SolarEdge, and Facebook could be worth a spot in a growth-oriented portfolio.",https://www.investopedia.com/investing/best-growth-stocks/,Positive,Best Growth Stocks for April 2020,Investopedia,0
2020-03-30 10:55:00-04:00,PYPL,payment stocks gain trillion stimulus package payment stocks gain traction recently passed stimulus package fight covid effect,Payment stocks to gain traction from the recently passed stimulus package to fight the COVID-19 effect.,http://www.zacks.com/stock/news/845341/payment-stocks-to-gain-from-%242-trillion-stimulus-package,Positive,Payment Stocks to Gain From $2 Trillion Stimulus Package,Zacks Investment Research,0
2020-03-31 08:47:00-04:00,PYPL,muted consumer confidence beat payment stocks soft consumer sentiment index prompted curtailment spending capacity sure dampen prospects payment stocks going forward,"Soft consumer sentiment index, prompted by curtailment in spending capacity, is sure to dampen the prospects of payment stocks going forward.",http://www.zacks.com/stock/news/846871/will-muted-consumer-confidence-beat-down-payment-stocks,Negative,Will Muted Consumer Confidence Beat Down Payment Stocks?,Zacks Investment Research,-1
2020-03-31 10:53:10-04:00,PYPL,paypal ceo dan schulman supporting small businesses platform dan schulman president ceo paypal joins squawk street discuss company programs support small businesses,"Dan Schulman, president and CEO of PayPal, joins ""Squawk on the Street"" to discuss the company's programs to support small businesses.",https://www.youtube.com/watch?v=GZqREmD4SkA,Neutral,PayPal CEO Dan Schulman on supporting small businesses on its platform,CNBC Television,-1
2020-03-31 12:09:33-04:00,PYPL,right thing paypal latest company take coronavirus layoffs pledge intend layoffs result covid paypal ceo dan schulman told cnbc tuesday,"""We don't intend to do any layoffs as a result of COVID-19,"" PayPal CEO Dan Schulman told CNBC on Tuesday.",https://www.cnbc.com/2020/03/31/paypal-ceo-dan-schulman-no-layoffs-of-employees-due-to-coronavirus.html,Positive,'This is the right thing' — PayPal is the latest company to take a no coronavirus-layoffs pledge,CNBC,-1
2020-03-31 21:56:41-04:00,PYPL,paypal announces small business client relief measures include doubling instant cash back rewards holders company mastercard business debit card,These include a doubling of instant cash back rewards for holders of the company's Mastercard business debit card.,https://www.fool.com/investing/2020/03/31/paypal-announces-small-business-client-relief-meas.aspx,Neutral,PayPal Announces Small Business Client Relief Measures,The Motley Fool,-1
2020-04-01 12:39:27-04:00,PYPL,paypal make difference paypal make difference,Paypal Can Make A Difference,https://seekingalpha.com/article/4335477-paypal-can-make-difference,Neutral,Paypal Can Make A Difference,Seeking Alpha,0
2020-04-03 14:28:32-04:00,PYPL,safest investments make covid chaos kayla matthews journalist writer covid thrown world uncertainty stock market responded tremendous plunges may made scared ever buy stocks,"By Kayla Matthews, Journalist & Writer COVID-19 has thrown the world into uncertainty. The stock market responded with tremendous plunges that may have made you scared to ever buy stocks again.",https://www.etftrends.com/disruptive-technology-channel/the-safest-investments-to-make-during-the-covid-19-chaos/,Positive,The Safest Investments to Make During The COVID-19 Chaos,ETF Trends,0
2020-04-03 17:45:18-04:00,PYPL,paypal pypl stock moves know latest trading session paypal pypl closed marking move previous day,"In the latest trading session, Paypal (PYPL) closed at $92.39, marking a -1.21% move from the previous day.",http://www.zacks.com/stock/news/853517/paypal-pypl-stock-moves-121-what-you-should-know,Neutral,Paypal (PYPL) Stock Moves -1.21%: What You Should Know,Zacks Investment Research,0
2020-04-06 12:13:00-04:00,PYPL,visa paypal payment stocks rising today could covid pandemic less economic impact previously feared,Could the COVID-19 pandemic have less of an economic impact than previously feared?,https://www.fool.com/investing/2020/04/06/heres-why-visa-paypal-and-other-payment-stocks-are.aspx,Positive,"Here's Why Visa, PayPal, and Other Payment Stocks Are Rising Today",The Motley Fool,1
2020-04-06 14:16:07-04:00,PYPL,coronavirus hinder paypal growth coronavirus hinder paypal growth,Coronavirus Won't Hinder PayPal's Growth,https://seekingalpha.com/article/4336257-coronavirus-wont-hinder-paypals-growth,Positive,Coronavirus Won't Hinder PayPal's Growth,Seeking Alpha,1
2020-04-06 16:23:42-04:00,PYPL,contactless payments get boost coronavirus pandemic precautions cnbc kate rooney reports increased demand contactless payment options due coronavirus,CNBC's Kate Rooney reports there is an increased demand for contactless payment options due to the coronavirus.,https://www.youtube.com/watch?v=6dtalmQaJtQ,Positive,Contactless payments get a boost from coronavirus pandemic precautions,CNBC Television,1
2020-04-07 13:47:13-04:00,PYPL,fintech stocks could materially benefit fintech disruption may rude awakening established institutions via many financial services fintech stocks see upside,"Fintech ""disruption"" may be a rude awakening for some established institutions. But via M&A, many of these financial services and fintech stocks see further upside.",https://investorplace.com/2020/04/5-fintech-stocks-that-could-materially-benefit-from-ma/,Positive,5 Fintech Stocks That Could Materially Benefit From M&A,InvestorPlace,0
2020-04-08 12:00:24-04:00,PYPL,paypal stock covid emergency provide opportunity gain share paypal stock could gain market share amid shifts merchant consumer behavior caused covid said one analyst exposure small business loans paypal immune,"PayPal stock could gain market share amid shifts in merchant and consumer behavior caused by Covid-19, said one analyst. But, with exposure to small business loans, PayPal is not immune.",https://www.investors.com/news/technology/paypal-stock-covid-19-outlook/,Positive,PayPal Stock: Will Covid-19 Emergency Provide Opportunity To Gain Share?,Investors Business Daily,0
2020-04-08 13:53:58-04:00,PYPL,medical device companies good values today askhalftime halftime report traders answer viewer questions askhalftime,"The ""Halftime Report"" traders answer viewer questions in #AskHalftime",https://www.youtube.com/watch?v=wr7lfRNRpx8,Neutral,What medical device companies are good values today? and more #AskHalftime,CNBC Television,0
2020-04-09 07:53:22-04:00,PYPL,trade day paypal stock ready reverse pypl stock rallied close past couple weeks strong run however stock approaching serious technical overhead resistance charts,PYPL stock rallied close to 30% over the past couple of weeks. After this strong run however the stock is approaching some serious technical overhead resistance on the charts.,https://investorplace.com/2020/04/trade-of-the-day-paypal-stock-is-ready-to-go-the-other-way-again/,Neutral,Trade of the Day: Paypal Stock Is Ready to Reverse Again,InvestorPlace,0
2020-04-09 08:00:00-04:00,PYPL,good quality sector etfs stocks buy right sectors extremely well positioned survive market shocks buy related etfs stocks,These sectors are extremely well-positioned to survive market shocks. Buy the related ETFs and stocks.,http://www.zacks.com/stock/news/862376/4-good-quality-sector-etfs-stocks-to-buy-right-now,Positive,4 Good Quality Sector ETFs & Stocks to Buy Right Now,Zacks Investment Research,0
2020-04-09 15:05:52-04:00,PYPL,paypal stock long term winner paypal represents great value right discounted price pypl stock offers attractive entry point long term investors post paypal stock long term winner appeared first investorplace,"PayPal represents great value right now, as the discounted price of PYPL stock offers an attractive entry point for long-term investors.
The post PayPal Stock Is a Long-Term Winner appeared first on InvestorPlace.",https://investorplace.com/2020/04/paypal-pypl-stock-is-a-long-term-winner/,Positive,PayPal Stock Is a Long-Term Winner,InvestorPlace,0
2020-04-09 17:45:19-04:00,PYPL,paypal pypl gains lags market know paypal pypl closed latest trading session marking move prior day,"Paypal (PYPL) closed at $105.84 in the latest trading session, marking a +0.74% move from the prior day.",http://www.zacks.com/stock/news/863617/paypal-pypl-gains-but-lags-market-what-you-should-know,Positive,Paypal (PYPL) Gains But Lags Market: What You Should Know,Zacks Investment Research,0
2020-04-10 21:48:13-04:00,PYPL,paypal intuit quickbooks approved take part coronavirus small business emergency loan program two companies among first non bank fintech companies approved small business association paycheck protection program,"The two companies are among the first non-bank, fintech companies to be approved for the Small Business Association's Paycheck Protection Program.",https://www.cnbc.com/2020/04/11/paypal-intuit-quickbooks-approved-for-coronavirus-small-business-loan.html,Neutral,"PayPal, Intuit QuickBooks approved to take part in coronavirus, small-business emergency loan program",CNBC,0
