time,symbol,text,raw_text,url,src_sentiment,raw_title,source_name,sentiment
2019-11-21 11:00:01-05:00,ADBE,photoshop ipad road map details much needed early updates company wants know app big missing capabilities important,Adobe wants you to know that the app's big missing capabilities are Very Important to it.,https://www.cnet.com/news/photoshop-for-ipad-roadmap-shows-the-important-features-coming-in-2020/,Neutral,Photoshop for iPad road map details much-needed early 2020 updates,CNET,0
2019-11-19 18:55:09-05:00,ADBE,selling software service stocks trade worries big mistake jim cramer says software service stocks tend come bouncing back alacrity companies forces nature mad money jim cramer says,"Software-as-a-service stocks ""tend to come bouncing back with alacrity because these companies are forces of nature,"" ""Mad Money's"" Jim Cramer says.",https://www.youtube.com/watch?v=4hWLuzpMh9I,Positive,"Selling software service stocks on trade worries is a 'big mistake,' Jim Cramer says",CNBC Television,0
2019-11-18 14:12:42-05:00,ADBE,subscription stocks buy long term gains supported strong subscription business models seven subscription stocks positioned big long term gains,"Supported by strong subscription business models, these seven subscription stocks are positioned for big, long-term gains.",https://investorplace.com/2019/11/7-subscription-stocks-to-buy-for-long-term-gains/,Positive,7 Subscription Stocks to Buy for Long-Term Gains,InvestorPlace,0
2019-11-15 16:18:04-05:00,ADBE,p close confirms powerful rally salesforce company amat nvidia showcase tech participation p close confirms powerful rally salesforce company amat nvidia showcase tech participation,"S&P Close Over 3100 Confirms A Powerful Rally. Salesforce, Adobe, AMAT, Nvidia Showcase Tech Participation",https://seekingalpha.com/article/4307163-s-and-p-close-3100-confirms-powerful-rally-salesforce-adobe-amat-nvidia-showcase-tech,Positive,"S&P Close Over 3100 Confirms A Powerful Rally. Salesforce, Adobe, AMAT, Nvidia Showcase Tech Participation",Seeking Alpha,0
2019-11-14 12:22:20-05:00,ADBE,company announces ga customer data platform customer data platform cdp newest tool customer experience arsenal big companies try help customers deal data coming multiple channels today company announced general availability cdp,"The customer data platform (CDP) is the newest tool in the customer experience arsenal as big companies try to help customers deal with data coming from multiple channels. Today, Adobe announced the general availability of its CDP.",https://techcrunch.com/2019/11/14/adobe-announces-ga-of-customer-data-platform/,Positive,Adobe announces GA of customer data platform,TechCrunch,0
2019-11-13 12:22:29-05:00,ADBE,want better resumé job company says focus five things job applicants talk academic technical skills show important creative skills even though postings specifically request new company study says company suggests five things resume include showcase,"Most job applicants talk about academic or technical skills, but don't show off important creative skills, even though most postings specifically request them, a new Adobe study says. The company suggests five things your resume' should include, and how to showcase them.",https://www.forbes.com/sites/dbloom/2019/11/13/want-a-better-resum-or-job-adobe-says-you-should-focus-on-these-five-things/,Positive,"Want A Better Resumé, Or Job? Adobe Says You Should Focus On These Five Things",Forbes,0
2019-11-13 11:00:06-05:00,ADBE,ipad photo editing get better lightroom upgrade coming soon lightroom ipads get useful update let import photos directly memory card company editing software,Lightroom and iPads both will get more useful with an update that'll let you import photos directly from a memory card into Adobe's editing software.,https://www.cnet.com/news/ipad-photo-editing-will-get-better-with-lightroom-upgrade-coming-soon/,Positive,iPad photo editing will get better with Lightroom upgrade coming soon,CNET,0
2019-11-13 08:45:06-05:00,ADBE,reasons company adbe great growth stock company adbe could produce exceptional returns solid growth attributes,Adobe (ADBE) could produce exceptional returns because of its solid growth attributes.,http://www.zacks.com/stock/news/617638/3-reasons-why-adobe-adbe-is-a-great-growth-stock,Positive,3 Reasons Why Adobe (ADBE) Is a Great Growth Stock,Zacks Investment Research,0
2019-11-13 08:03:00-05:00,ADBE,company top growth stock years company expecting another strong performance,The company is expecting another strong performance in 2020.,https://www.fool.com/investing/2019/11/13/why-adobe-will-be-a-top-growth-stock-for-years.aspx,Neutral,Why Adobe Will Be a Top Growth Stock for Years,The Motley Fool,0
2019-11-12 13:29:16-05:00,ADBE,company microsoft deepen cloud computing partnership software companies company microsoft tuesday announced expanding cloud computing partnership deeper customer experience management stocks rose news,Software companies Adobe and Microsoft on Tuesday announced that they are expanding their cloud computing partnership deeper into customer experience management. Both stocks rose on the news.,https://www.investors.com/news/technology/adobe-stock-microsoft-stock-climb-expanded-cloud-computing-partnership/,Positive,"Adobe, Microsoft Deepen Cloud Computing Partnership",Investors Business Daily,0
2019-11-12 07:00:10-05:00,ADBE,investors jump jefferies top growth stock picks results increasingly companies cover wall street starting agree future still bright u,"Increasingly, the companies that we cover on Wall Street are starting to agree that while the future is still bright for the U.S.",https://247wallst.com/investing/2019/11/12/why-investors-should-jump-on-jefferies-top-growth-stock-picks-after-q3-results/,Positive,Why Investors Should Jump on Jefferies Top Growth Stock Picks After Q3 Results,24/7 Wall Street,0
2019-11-08 11:34:45-05:00,ADBE,stocks buy leadership star management teams behind every great stock great management team five stocks may best management teams,Behind every great stock is a great management team. These five stocks may have the best management teams out there.,https://investorplace.com/2019/11/5-stocks-to-buy-with-leadership-from-all-star-management-teams/,Positive,5 Stocks to Buy With Leadership From All-Star Management Teams,InvestorPlace,0
2019-11-07 12:02:53-05:00,ADBE,company salesforce fight dominance marketing software tech giant winning battle enterprise marketing software sales,Which tech giant is winning the battle for enterprise marketing software sales?,https://www.fool.com/investing/2019/11/07/adobe-salesforce-fight-dominate-market-software.aspx,Neutral,Adobe and Salesforce Fight for Dominance in Marketing Software,The Motley Fool,0
2019-11-07 08:15:00-05:00,ADBE,company acquisition spree pay since acquired three marketing software companies looking get piece salesforce com financial pie,"Since 2017, it has acquired three marketing software companies and is looking to get a piece of Salesforce.com's financial pie.",https://www.fool.com/investing/2019/11/07/will-adobes-acquisition-spree-pay-off.aspx,Positive,Will Adobe's Acquisition Spree Pay Off?,The Motley Fool,0
2019-11-06 10:12:59-05:00,ADBE,company stock price rallies guidance breakout unlikely adbe company systems adbe rose tuesday company updated annual guidance led multiple analysts update projections higher stock rising phase current market cycle see depth last decline negative warning,"Adobe Systems (ADBE) rose by 4% on Tuesday, after the company updated its annual guidance, which led multiple analysts to update projections higher. While the stock is in the rising phase of its current market cycle, we see the depth of the last decline is a negative warning.",https://www.seeitmarket.com/adobe-stock-price-rallies-on-guidance-but-breakout-unlikely-adbe/,Positive,Adobe Stock Price Rallies On Guidance But Breakout Unlikely (ADBE),See It Market,0
2019-11-05 17:26:41-05:00,ADBE,company project sweet talk makes portraits come alive one interesting sessions company max traditionally sneaks keynote engineers company various units show cutting edge work sometimes turn products,"One of the most interesting sessions at Adobe MAX is traditionally the Sneaks keynote, where engineers from the company’s various units show off their most cutting-edge work. Sometimes, those turn into products.",https://techcrunch.com/2019/11/05/adobes-project-sweet-talk-makes-portraits-come-alive/,Positive,Adobe’s Project Sweet Talk makes portraits come alive,TechCrunch,0
2019-11-05 17:13:55-05:00,ADBE,company ceo shantanu narayen content company core company chairman ceo shantanu narayen joins cnbc jon fortt company company max conference discuss outlook company new features coming creative cloud,Adobe chairman and CEO Shantanu Narayen joins CNBC's Jon Fortt at the company's Adobe Max conference to discuss the outlook for the company and new features coming to Creative Cloud.,https://www.youtube.com/watch?v=tvZ6vKKGPRY,Positive,Adobe CEO Shantanu Narayen: We are a content company at our core,CNBC Television,0
2019-11-05 13:53:25-05:00,ADBE,company stock gets price target hikes creative cloud news wall street analysts applauded company tuesday latest software creative professionals announced company max conference los angeles company stock rose,"Wall Street analysts applauded Adobe on Tuesday for its latest software for creative professionals, which it announced at its Adobe Max conference in Los Angeles. Adobe stock rose.",https://www.investors.com/news/technology/adobe-stock-gets-price-target-hikes-creative-cloud-news/,Positive,Adobe Stock Gets Price-Target Hikes On Creative Cloud News,Investors Business Daily,0
2019-11-05 11:59:36-05:00,ADBE,photoshop goes mobile top announcements company max show much anticipated photoshop ipad fresco drawing app windows ai powered photoshop camera app smartphones among new products updates rolled company inc nasdaq adbe annual design conference,"The much-anticipated Photoshop for iPad, the Fresco drawing app for Windows and an AI-powered Photoshop camera app for smartphones are among the new products or updates rolled out by Adobe Inc (NASDAQ: ADBE) at its annual design conference.",https://www.benzinga.com/news/19/11/14733820/photoshop-goes-mobile-top-announcements-from-the-adobe-max-show,Positive,Photoshop Goes Mobile: Top Announcements From The Adobe MAX Show,Benzinga,0
2019-11-04 17:40:43-05:00,ADBE,company stock rallies outlook company inc adbe shares rallied extended session monday software company forecast topped wall street estimates,"Adobe Inc. ADBE, -0.12% shares rallied in the extended session Monday after the software company's forecast topped Wall Street estimates.",https://www.marketwatch.com/story/adobe-stock-rallies-after-2020-outlook-2019-11-04,Positive,Adobe stock rallies after 2020 outlook,Market Watch,0
2019-11-04 16:55:34-05:00,ADBE,company shares jump strong fy guidance shares company jumped company offered guidance fiscal year estimates,Shares of Adobe jumped after the company offered guidance for fiscal year 2020 that was above estimates.,https://www.youtube.com/watch?v=EDnywvRhbUY,Positive,Adobe shares jump on strong FY 2020 guidance,CNBC Television,0
2019-11-04 09:33:02-05:00,ADBE,company bringing illustrator ipad company bringing another desktop class imaging graphics apps ipad illustrator set launch win company announced today annual max conference last year company announced similar plan deliver photoshop ipad app launched app store early,"Adobe will be bringing another of its desktop-class imaging and graphics apps to the iPad: Illustrator, which is set for a launch win 2020, the company announced today at its annual MAX conference. Last year, Adobe announced a similar plan to deliver Photoshop for iPad, and that app launched on the App Store early on […]",https://techcrunch.com/2019/11/04/adobe-is-bringing-illustrator-to-the-ipad-in-2020/,Positive,Adobe is bringing Illustrator to the iPad in 2020,TechCrunch,0
2019-11-04 09:13:47-05:00,ADBE,magic viewfinder company photoshop camera brings ai powered creativity smartphone today company unveiled photoshop camera ai powered app dramatically transform way hundreds millions people experience capture share lives smartphones,"Today Adobe unveiled its Photoshop Camera, an AI-powered app that will dramatically transform the way hundreds of millions of people experience, capture and share their lives through their smartphones.",https://www.forbes.com/sites/marcoannunziata/2019/11/04/magic-in-the-viewfinder-adobes-photoshop-camera-brings-ai-powered-creativity-to-your-smartphone/,Positive,Magic In The Viewfinder: Adobe’s Photoshop Camera Brings AI-Powered Creativity To Your Smartphone,Forbes,0
2019-11-04 09:12:36-05:00,ADBE,company photoshop camera ai powered photo editor phone instagram snapchat changed way people look photo editing task limited wildly expensive tools years training become accessible anyone smartphone,  Instagram and Snapchat have changed the way people look at photo editing. What was once a task limited to those with wildly expensive tools and years of training has become accessible to anyone with a smartphone.,https://techcrunch.com/2019/11/04/adobes-photoshop-camera-is-an-ai-powered-photo-editor-for-your-phone/,Positive,Adobe’s Photoshop Camera is an AI-powered photo editor for your phone,TechCrunch,0
2019-11-04 09:00:36-05:00,ADBE,company launches aero ar authoring app company ambitions around augmented reality ar secret plenty potential building right design tools ar developers last year max event company first demoed aero ar authoring app today launching public free app ios,"Adobe’s ambitions around augmented reality (AR) are no secret — there’s plenty of potential for building the right design tools for AR developers, after all. At last year’s Max event, the company first demoed its Aero AR authoring app and today, it is launching it to the public as a free app on iOS and […]",https://techcrunch.com/2019/11/04/adobe-launches-aero-its-ar-authoring-app/,Positive,"Adobe launches Aero, its AR authoring app",TechCrunch,0
2019-11-04 09:00:27-05:00,ADBE,company launches photoshop ipad photoshop camera app deck illustrator ipad company continues next generation expansion mobile,"On deck, Illustrator on iPad as Adobe continues its next-generation expansion into mobile.",https://www.cnet.com/news/adobe-launches-photoshop-for-ipad-photoshop-camera-app-and-more/,Positive,"Adobe launches Photoshop for iPad, Photoshop Camera app and more",CNET,0
2019-11-04 09:00:27-05:00,ADBE,company bringing real time collaboration xd design tool company max week company annual creative cloud event like every year company announcing slew updates across products sometimes small tweaks feature additions company xd company design prototyping tool web app development getting number interesting updates,"It’s Adobe Max this week, Adobe’s annual Creative Cloud event, and like every year, the company is announcing a slew of updates across its products. Sometimes these are only small tweaks and feature additions, but Adobe XD, the company’s design and prototyping tool for web and app development, is getting a number of interesting updates […]",https://techcrunch.com/2019/11/04/adobe-is-bringing-real-time-collaboration-to-its-xd-design-tool/,Positive,Adobe is bringing real-time collaboration to its XD design tool,TechCrunch,0
2019-11-04 09:00:07-05:00,ADBE,company fresco drawing app available windows september company launched fresco next gen drawing painting app ipad today fresco also coming windows starting microsoft surface line starting surface pro surface go surface studio book devices wacom mobile studio devices,"In September, Adobe launched Fresco, its next-gen drawing and painting app, for the iPad. Today, Fresco is also coming to Windows, starting with Microsoft’s Surface line (starting with the Surface Pro 4, the Surface Go and all Surface Studio and Book devices) and Wacom Mobile Studio devices.",https://techcrunch.com/2019/11/04/adobes-fresco-drawing-app-is-now-available-on-windows/,Neutral,Adobe’s Fresco drawing app is now available on Windows,TechCrunch,0
2019-11-04 07:51:22-05:00,ADBE,company photoshop arrives ipad company released photoshop ipad announcing would bringing popular professional photo editing software apple tablets officially last october company said would launching app made good schedule release today,"Adobe has released Photoshop for the iPad, after announcing that it would be bringing its popular professional photo-editing software to Apple’s tablets officially last October. Adobe said that it would be launching the app in 2019, and it has made good on that schedule with the release today.",https://techcrunch.com/2019/11/04/adobe-photoshop-arrives-on-the-ipad/,Positive,Adobe Photoshop arrives on the iPad,TechCrunch,0
2019-11-04 04:00:31-05:00,ADBE,company new app puts photoshop inside phone camera company new ai powered camera app start big push consumer software demo company new ai powered camera app saw daytime photos made look like shot night portrait photos turned andy warhol style pop art faces smeared virtual paint show team pride sporting events,"Adobe’s new AI-powered camera app is the start of a big push into consumer software.
In a demo of Adobe’s new AI-powered camera app, I saw daytime photos made to look like they were shot at night, portrait photos turned into Andy Warhol-style pop art, and faces smeared with virtual paint to show team pride at sporting events.",https://www.fastcompany.com/90425790/adobes-new-app-puts-photoshop-directly-inside-your-camera,Positive,Adobe’s new app puts Photoshop inside your phone camera,Fast Company,0
2019-11-02 07:59:00-04:00,ADBE,best calls week wall street nov interesting analyst calls week,Here are some of the most interesting analyst calls of the week,https://www.cnbc.com/2019/11/02/stock-market-calls-of-the-week-pinterest-kroger-salesforce.html,Positive,Here are the best calls of the week on Wall Street (Nov 2),CNBC,0
2019-10-31 17:45:21-04:00,ADBE,company systems adbe stock moves know company systems adbe closed latest trading session marking move prior day,"Adobe Systems (ADBE) closed at $277.93 in the latest trading session, marking a -0.17% move from the prior day.",http://www.zacks.com/stock/news/597012/adobe-systems-adbe-stock-moves-017-what-you-should-know,Neutral,Adobe Systems (ADBE) Stock Moves -0.17%: What You Should Know,Zacks Investment Research,0
2019-10-29 13:55:25-04:00,ADBE,online spending exceed billion day november december company analytics company analytics forecasts online spending exceed billion every day months november december,Adobe Analytics forecasts that online spending will exceed $1 billion every day during the months of November and December.,https://www.marketwatch.com/story/online-spending-will-exceed-1-billion-each-day-in-november-and-december-adobe-analytics-2019-10-29,Neutral,Online spending will exceed $1 billion each day in November and December: Adobe Analytics,Market Watch,0
2019-10-28 13:22:18-04:00,ADBE,final trades company gm abbvie halftime report traders give top stocks watch second half,"The ""Halftime Report"" traders give their top stocks to watch for the second half.",https://www.youtube.com/watch?v=7s5zUEEwYEg,Positive,"Final Trades: Adobe, GM, Abbvie & more",CNBC Television,0
2019-10-28 10:18:00-04:00,ADBE,stocks make cloud computing boom cloud computing growing rapidly estimated cagr investing five stocks might beneficial investors,Cloud computing is growing rapidly and with an estimated CAGR of 22.3% in 2023 investing in these five stocks might be beneficial for investors.,http://www.zacks.com/stock/news/588347/5-stocks-to-make-the-most-of-the-cloud-computing-boom,Positive,5 Stocks to Make the Most of the Cloud Computing Boom,Zacks Investment Research,0
2019-10-28 08:45:05-04:00,ADBE,reasons growth investors overlook company adbe company adbe could produce exceptional returns solid growth attributes,Adobe (ADBE) could produce exceptional returns because of its solid growth attributes.,http://www.zacks.com/stock/news/588119/3-reasons-why-growth-investors-shouldnt-overlook-adobe-adbe,Positive,3 Reasons Why Growth Investors Shouldn't Overlook Adobe (ADBE),Zacks Investment Research,0
2019-10-25 20:43:00-04:00,ADBE,three stocks build portfolio around tech stock restaurant stock entertainment brand known around world made list,"A tech stock, a restaurant stock, and an entertainment brand known around the world made this list.",https://www.fool.com/investing/2019/10/25/3-stocks-to-build-your-portfolio-around.aspx,Positive,Three Stocks - to Build Your Portfolio Around.,The Motley Fool,0
2019-10-25 14:15:00-04:00,ADBE,blue chip tech stocks investors buy amid earnings season searched using zacks stock screener large cap blue chip tech stocks look stable poised expand even difficult environment,"We searched using our Zacks Stock Screener for large-cap, blue-chip tech stocks that look both stable and poised to expand even in a difficult environment.",http://www.zacks.com/stock/news/584564/blue-chip-tech-stocks-for-investors-to-buy-amid-q3-2019-earnings-season,Positive,Blue-Chip Tech Stocks for Investors to Buy Amid Q3 2019 Earnings Season,Zacks Investment Research,0
2019-10-24 22:32:00-04:00,ADBE,stocks named tesla rocketed higher thursday tesla major stock saw nice rise day,Tesla wasn't the only major stock that saw a nice rise on the day.,https://www.fool.com/investing/2019/10/24/2-stocks-not-named-tesla-that-rocketed-higher-on-t.aspx,Positive,"2 Stocks Not Named ""Tesla"" That Rocketed Higher on Thursday",The Motley Fool,0
2019-10-24 19:37:06-04:00,ADBE,software stocks worth buying pullback according jim cramer today cloud stocks proved bounce months agony think start gradually buying highest quality names mad money host says,"""Today the cloud stocks proved they can bounce, and after months of agony ... I think you can start gradually ... buying the highest quality names here,"" the ""Mad Money"" host says.",https://www.youtube.com/watch?v=vXnoLK_Oino,Positive,"Some software stocks are worth buying on the pullback, according to Jim Cramer",CNBC Television,0
2019-10-24 13:34:16-04:00,ADBE,gold miners pharma fintech askhalftime halftime report traders answer viewer questions askhalftime,"The ""Halftime Report"" traders answer viewer questions in #AskHalftime",https://www.youtube.com/watch?v=8cXRpWtM5AM,Neutral,"Gold miners, Pharma, Fintech and more in #AskHalftime",CNBC Television,0
2019-10-24 09:13:51-04:00,ADBE,collect income company market consolidates company nasdaq adbe able harness bullish enthusiasm pushed p back near time highs making perfect time covered call,"Adobe (NASDAQ:ADBE) hasn’t been able to harness the bullish enthusiasm that has pushed the S&P 500 back up near its all-time highs, making now a perfect time for a covered call.",https://investorplace.com/2019/10/collect-income-on-adobe-adbe-market-consolidates/,Negative,Collect Income on Adobe While the Market Consolidates,InvestorPlace,0
2019-10-23 11:17:00-04:00,ADBE,company adbe gears launch illustrator app ipad company adbe plans launch ipad version illustrator next major project photoshop,Adobe (ADBE) plans to launch an iPad version of Illustrator as the next major project after Photoshop.,http://www.zacks.com/stock/news/580404/adobe-adbe-gears-up-to-launch-illustrator-app-for-ipad,Positive,Adobe (ADBE) Gears Up to Launch Illustrator App for iPad,Zacks Investment Research,0
2019-10-22 07:24:06-04:00,ADBE,big stock charts tuesday johnson johnson company applied materials big stock charts highlight big names big trends market waiting direction ahead earnings season post big stock charts tuesday johnson johnson company applied materials appeared first investorplace,"These 3 big stock charts highlight big names, and big trends, in a market waiting for direction ahead of earnings season.
The post 3 Big Stock Charts for Tuesday: Johnson & Johnson, Adobe, and Applied Materials appeared first on InvestorPlace.",https://investorplace.com/2019/10/3-big-stock-charts-tuesday-johnson-johnson-adobe-applied-materials/,Positive,"3 Big Stock Charts for Tuesday: Johnson & Johnson, Adobe, and Applied Materials",InvestorPlace,0
2019-10-22 02:00:10-04:00,ADBE,magento begins integrate deeply company stack company acquired magento e commerce platform aimed smbs last may billion knew would matter time company would begin integrating new purchase company technology stack today magentolive customer conference amsterdam magento announced new integrations company,"When Adobe acquired Magento, the e-commerce platform aimed at SMBs, last May for $1.68 billion, you knew it would only be a matter of time before the company would begin integrating its new purchase into the Adobe technology stack. Today, at the MagentoLive customer conference in Amsterdam, Magento announced some new integrations with Adobe.",https://techcrunch.com/2019/10/21/magento-begins-to-integrate-more-deeply-into-the-adobe-stack/,Neutral,Magento begins to integrate more deeply into the Adobe stack,TechCrunch,0
2019-10-21 13:26:33-04:00,ADBE,final trades amd copart company halftime report traders give top stocks watch second half,"The ""Halftime Report"" traders give their top stocks to watch for the second half.",https://www.youtube.com/watch?v=u31EDC9Hkug,Positive,"Final Trades: AMD, Copart, Adobe & more",CNBC Television,0
2019-10-18 18:10:27-04:00,ADBE,last chance trade company steve weiss chief investment officer short hills capital offers last chance trade today,"Steve Weiss, chief investment officer of Short Hills Capital, offers his last chance trade for today.",https://www.youtube.com/watch?v=5fEo2yZ9w90,Positive,Last Chance Trade: Adobe,CNBC Television,0
