time,symbol,text,raw_text,url,src_sentiment,raw_title,source_name,sentiment
2019-10-23 08:00:29-04:00,PYPL,wall street waits paypal offer insight picture paypal holdings reports third quarter earnings analysts looking initial fiscal guidance including impact former parent ebay phasing financial ties post wall street waits paypal offer insight picture appeared first investor business daily,"When PayPal Holdings reports third-quarter earnings, analysts will be looking for initial fiscal 2020 guidance, including the impact of former parent eBay phasing out financial ties.   
The post Wall Street Waits For PayPal To Offer Insight Into 2020 Picture appeared first on Investor's Business Daily.",https://www.investors.com/news/technology/paypal-earnings-pypl-stock-2020-guidance/,Neutral,Wall Street Waits For PayPal To Offer Insight Into 2020 Picture,Investors Business Daily,1
2019-10-23 16:15:37-04:00,PYPL,earnings results paypal beats earnings revenue volume third quarter paypal holdings inc beat estimates across board wednesday company delivered third quarter numbers,PayPal Holdings Inc. beat estimates across the board on Wednesday as the company delivered its third-quarter numbers.,https://www.marketwatch.com/story/paypal-beats-on-earnings-revenue-and-volume-for-the-third-quarter-2019-10-23,Positive,"Earnings Results: PayPal beats on earnings, revenue and volume for the third quarter",Market Watch,1
2019-10-23 16:49:19-04:00,PYPL,paypal beats top bottom cnbc leslie picker reports paypal earnings,CNBC's Leslie Picker reports on PayPal earnings.,https://www.youtube.com/watch?v=pE1sRCAnDQ0,Positive,PayPal beats on top and bottom,CNBC Television,1
2019-10-23 16:50:57-04:00,PYPL,strength paypal network effect paypal huge dense network grow customer engagement number active accounts stable pace,PayPal has a huge and dense network and can grow its customer engagement and number of active accounts at a stable pace.,https://seekingalpha.com/article/4298338-strength-paypals-network-effect,Positive,The Strength Of PayPal's Network Effect,Seeking Alpha,1
2019-10-23 16:51:48-04:00,PYPL,payments leader tops views several metrics stock jumps paypal holdings earnings revenue topped analyst estimates late wednesday amid lowered expectations,PayPal Holdings Q3 earnings and revenue topped analyst estimates late Wednesday amid lowered expectations.,https://www.investors.com/news/technology/paypal-earnings-pypl-stock-q32019/,Positive,This Payments Leader Tops Views On Several Metrics; Stock Jumps,Investors Business Daily,1
2019-10-23 17:03:46-04:00,PYPL,paypal earnings pypl stock rockets higher earnings beat paypal pypl earnings company third quarter pypl stock surging hours trading wednesday,PayPal (PYPL) earnings for the company's third quarter of 2019 have PYPL stock surging in after-hours trading on Wednesday.,https://investorplace.com/2019/10/paypal-earnings-send-pypl-stock-surging/,Positive,PayPal Earnings: PYPL Stock Rockets 9% Higher on Q3 Earnings Beat,InvestorPlace,1
2019-10-23 17:45:07-04:00,PYPL,paypal pypl earnings revenues top estimates paypal pypl delivered earnings revenue surprises respectively quarter ended september numbers hold clues lies ahead stock,"Paypal (PYPL) delivered earnings and revenue surprises of 17.31% and 0.85%, respectively, for the quarter ended September 2019. Do the numbers hold clues to what lies ahead for the stock?",http://www.zacks.com/stock/news/580862/paypal-pypl-q3-earnings-and-revenues-top-estimates,Positive,Paypal (PYPL) Q3 Earnings and Revenues Top Estimates,Zacks Investment Research,1
2019-10-23 21:38:07-04:00,PYPL,paypal holdings pypl ceo dan schulman results earnings call transcript paypal holdings pypl ceo dan schulman results earnings call transcript,PayPal Holdings' (PYPL) CEO Dan Schulman on Q3 2019 Results - Earnings Call Transcript,https://seekingalpha.com/article/4298414-paypal-holdings-pypl-ceo-dan-schulman-q3-2019-results-earnings-call-transcript,Neutral,PayPal Holdings' (PYPL) CEO Dan Schulman on Q3 2019 Results - Earnings Call Transcript,Seeking Alpha,1
2019-10-23 22:45:51-04:00,PYPL,paypal reports solid third quarter results total payment volume growing paypal reported third quarter results today slightly ahead analysts expectations driven increase total payment volume,"PayPal reported third-quarter results today that were slightly ahead of analysts’ expectations, driven by an increase in total payment volume.",https://techcrunch.com/2019/10/23/paypal-reports-solid-third-quarter-results-with-total-payment-volume-growing-25/,Positive,"PayPal reports solid third-quarter results, with total payment volume growing 25%",TechCrunch,1
2019-10-24 06:28:00-04:00,PYPL,paypal tops wall street estimates higher customer traffic shares rally paypal reported better expected quarterly profit wednesday people used payment processing platform make transactions forecast full year adjusted profit wall street estimates,PayPal reported a better-than-expected quarterly profit on Wednesday as more people used its payment processing platform to make transactions and forecast full-year adjusted profit above Wall Street estimates.,https://www.cnbc.com/2019/10/24/paypal-pypl-earnings-q3-2019.html,Positive,"PayPal tops Wall Street estimates on higher customer traffic, shares rally",CNBC,0
2019-10-24 08:57:00-04:00,PYPL,paypal surges strongest results least year seeing growth venmo shares paypal jumped pre market trading thursday payment company beat wall street expectations third quarter,Shares of PayPal jumped in pre-market trading Thursday after the payment company beat Wall Street's expectations for the third quarter.,https://www.cnbc.com/2019/10/24/paypal-surges-after-strongest-results-in-at-least-a-year.html,Positive,"PayPal surges 8% after strongest results in at least a year, seeing growth in Venmo",CNBC,0
2019-10-24 09:21:05-04:00,PYPL,thursday vital data texas instruments paypal twitter options trading buzzing texas instruments paypal twitter wednesday metrics matter moving forward,"Options trading was buzzing in Texas Instruments, PayPal and Twitter on Wednesday. Here are the metrics that matter moving forward.",https://investorplace.com/2019/10/thursdays-vital-data-texas-instruments-paypal-and-twitter/,Neutral,"Thursday’s Vital Data: Texas Instruments, PayPal and Twitter",InvestorPlace,0
2019-10-24 09:46:35-04:00,PYPL,paypal holdings soar hours following earnings beat closing bell wednesday paypal holdings inc nasdaq pypl issued third quarter results,"After the closing bell on Wednesday, PayPal Holdings, Inc. (NASDAQ:PYPL) issued its third-quarter results.",http://www.gurufocus.com/news/969194/paypal-holdings-soar-in-after-hours-following-earnings-beat-,Positive,PayPal Holdings Soar in After Hours Following Earnings Beat,GuruFocus,0
2019-10-24 10:38:42-04:00,PYPL,paypal tops estimates opens doors massive growth paypal holdings inc nasdaq pypl expected deliver year year increase earnings higher revenues third quarter ended september,"PayPal Holdings, Inc., (NASDAQ: PYPL) was expected to deliver a year-over-year increase in earnings and higher revenues during the third quarter that ended on September 30th 2019.",https://www.benzinga.com/news/earnings/19/10/14654523/paypal-tops-estimates-and-opens-doors-to-massive-growth,Positive,PayPal Tops Estimates And Opens Doors To Massive Growth,Benzinga,0
2019-10-24 10:55:00-04:00,PYPL,ratings game paypal back fast lane earnings address ebay partnership fears paypal holdings inc soothed key investor fears latest earnings commentary helping send shares higher thursday trading,"PayPal Holdings Inc. soothed some key investor fears with its latest earnings commentary, helping to send shares higher in Thursday trading.",https://www.marketwatch.com/story/paypal-is-back-into-the-fast-lane-after-earnings-address-ebay-partnership-fears-2019-10-24,Neutral,"The Ratings Game: PayPal is ‘back into the fast lane’ after earnings address eBay, partnership fears",Market Watch,0
2019-10-24 10:55:00-04:00,PYPL,paypal pypl beats earnings revenue estimates paypal pypl third quarter results reflect uptick net new active accounts strengthening customer engagement platform portfolio strength,"PayPal's (PYPL) third-quarter results reflect an uptick in net new active accounts, strengthening customer engagement on its platform and portfolio strength.",http://www.zacks.com/stock/news/582328/paypal-pypl-beats-earnings-and-revenue-estimates-in-q3,Positive,PayPal (PYPL) Beats Earnings and Revenue Estimates in Q3,Zacks Investment Research,0
2019-10-24 11:28:25-04:00,PYPL,paypal stock rising today investors seem happy company progress,Investors seem more than happy with the company's progress.,https://www.fool.com/investing/2019/10/24/heres-why-paypal-stock-is-rising-today.aspx,Positive,Here's Why PayPal Stock Is Rising Today,The Motley Fool,0
2019-10-24 12:13:44-04:00,PYPL,paypal cfo john rainey earnings underbanked paypal cfo john rainey joins squawk alley discuss company beat earnings driven higher customer traffic rainey member cnbc global cfo council,"PayPal CFO John Rainey joins ""Squawk Alley"" to discuss the company's beat on earnings in Q3, driven by higher customer traffic. Rainey is a member of CNBC's Global CFO Council.",https://www.youtube.com/watch?v=VZ0VDx4nIo8,Positive,PayPal CFO John Rainey on earnings and the underbanked,CNBC Television,0
2019-10-24 12:37:29-04:00,PYPL,paypal cfo talked death cash years paypal cfo john rainey discusses end cash rise digital payments cnbc squawk alley team,"PayPal CFO John Rainey discusses the end of cash and the rise of digital payments with CNBC's ""Squawk Alley"" team.",https://www.youtube.com/watch?v=9anDdVjqp6A,Neutral,PayPal CFO: We've talked about the death of cash for years and 'it's here',CNBC Television,0
2019-10-24 14:09:00-04:00,PYPL,surprising ways paypal third quarter update impressed investors lot like account increases peer peer payments,"There was a lot to like about account increases, peer-to-peer payments, and more.",https://www.fool.com/investing/2019/10/24/4-surprising-ways-paypals-third-quarter-update-imp.aspx,Positive,4 Surprising Ways PayPal's Third-Quarter Update Impressed Investors,The Motley Fool,0
2019-10-24 15:08:43-04:00,PYPL,paypal calms investor fears soundly thrashing expectations latest earnings release payments processor proved growth story intact,"In its latest earnings release, the payments processor proved -- once again -- that its growth story is intact.",https://www.fool.com/investing/2019/10/24/paypal-calms-investor-fears-earnings-expectations.aspx,Positive,PayPal Calms Investor Fears by Soundly Thrashing Q3 Expectations,The Motley Fool,0
2019-10-24 15:41:21-04:00,PYPL,street still loves paypal paypal holdings inc nasdaq pypl reported third quarter results wednesday beat estimates prompted multiple street analysts reaffirm bullish stances,Paypal Holdings Inc (NASDAQ: PYPL) reported third-quarter results Wednesday that beat estimates and prompted multiple Street analysts to reaffirm bullish stances.,https://www.benzinga.com/analyst-ratings/analyst-color/19/10/14657337/the-street-still-loves-paypal,Positive,The Street Still Loves PayPal,Benzinga,0
2019-10-24 15:48:54-04:00,PYPL,top stock trades friday twtr pypl f mmm lrcx ford paypal twitter co lam research top stock trades thursday look charts,"Ford, PayPal, Twitter, 3M Co and Lam Research were our top stock trades from Thursday. Here's a look at their charts.",https://investorplace.com/2019/10/5-top-stock-trades-for-friday-twtr-pypl-f/,Positive,"5 Top Stock Trades for Friday: TWTR, PYPL, F, MMM & LRCX",InvestorPlace,0
2019-10-24 16:31:00-04:00,PYPL,align technology tilray paypal holdings jumped today markets continued let financial reports drive gains losses,Markets continued to let financial reports drive gains and losses.,https://www.fool.com/investing/2019/10/24/why-align-technology-tilray-and-paypal-holdings-ju.aspx,Positive,"Why Align Technology, Tilray, and PayPal Holdings Jumped Today",The Motley Fool,0
2019-10-24 19:19:29-04:00,PYPL,jim cramer breaks companies winning china despite trade war number american companies able win chinese consumer jim cramer says,"Despite the trade war, a number of American companies have been able to win over the Chinese consumer, Jim Cramer says.",https://www.youtube.com/watch?v=EScYdJHeoHQ,Positive,Jim Cramer breaks down the companies that are winning in China,CNBC Television,0
2019-10-25 08:50:00-04:00,PYPL,paypal pypl catches eye stock jumps paypal pypl saw big move last session shares jumped nearly day amid huge volumes,"PayPal (PYPL) saw a big move last session, as its shares jumped nearly 9% on the day, amid huge volumes.",http://www.zacks.com/stock/news/583849/paypal-pypl-catches-eye-stock-jumps-86,Positive,PayPal (PYPL) Catches Eye: Stock Jumps 8.6%,Zacks Investment Research,0
2019-10-25 11:48:29-04:00,PYPL,post earnings stocks buy better expected results solid looking charts smart purchase strategies made three names stocks buy,"Better-than-expected results, solid-looking charts and smart purchase strategies have made these three names stocks to buy now.",https://investorplace.com/2019/10/3-post-earnings-stocks-to-buy-now/,Positive,3 Post-Earnings Stocks to Buy Now,InvestorPlace,0
2019-10-25 14:30:00-04:00,PYPL,etfs ride paypal outperformance paypal beats overall makes investable,PayPal beats overall in Q3 and makes these investable.,http://www.zacks.com/stock/news/584574/etfs-to-ride-on-paypals-q3-outperformance,Neutral,ETFs to Ride on PayPal's Q3 Outperformance,Zacks Investment Research,0
2019-10-26 12:00:00-04:00,PYPL,venmo growth would impressive square cash app cash app growth numbers monetization progress overshadow massive success paypal,Cash App's growth numbers and monetization progress overshadow a massive success for PayPal.,https://www.fool.com/investing/2019/10/26/venmos-growth-would-be-impressive-if-it-werent-for.aspx,Positive,Venmo's Growth Would Be Impressive if It Weren't for Square's Cash App,The Motley Fool,0
2019-10-27 09:06:00-04:00,PYPL,stocks buy hold decades investment worry free companies come close,"No investment is worry-free, but these companies come close.",https://www.fool.com/investing/2019/10/27/3-stocks-to-buy-and-hold-for-decades.aspx,Positive,3 Stocks - to Buy and Hold for Decades,The Motley Fool,0
2019-10-27 11:32:00-04:00,PYPL,forget apple card paypal best digital payments stock company continues embed everyday life around globe,The company continues to further embed itself in everyday life around the globe.,https://www.fool.com/investing/2019/10/27/forget-apple-paypal-is-best-digital-payments-stock.aspx,Positive,"Forget Apple Card, PayPal Is the Best Digital Payments Stock",The Motley Fool,0
2019-10-27 16:00:00-04:00,PYPL,paypal momentum spreading across world financial institutions leading brands governments getting cozy digital payment provider,"More financial institutions, leading brands, and governments are getting cozy with the digital payment provider.",https://www.fool.com/investing/2019/10/27/paypals-momentum-is-spreading-across-the-world.aspx,Positive,PayPal's Momentum Is Spreading Across the World,The Motley Fool,0
2019-10-28 11:08:00-04:00,PYPL,xi blockchain push boon bitcoin stocks china president xi jinping said party must focus bumping investments blockchain technology helped blockchain related stocks including bitcoin scale north,"China president Xi Jinping said that his party must focus on bumping up investments in blockchain technology. This helped blockchain-related stocks, including bitcoin, scale north.",http://www.zacks.com/stock/news/588642/xis-blockchain-push-a-boon-for-bitcoin-stocks,Positive,Xi's Blockchain Push a Boon for Bitcoin Stocks,Zacks Investment Research,0
2019-10-29 07:00:56-04:00,PYPL,venmo add cash back rewards users debit card paypal holdings inc venmo brand adding cash back rewards users debit card bid entice users try venmo service things sending money friends,PayPal Holdings Inc.’s Venmo brand is adding cash-back rewards for users of its debit card in a further bid to entice users to try the Venmo service for things other than sending money to friends.,https://www.marketwatch.com/story/venmo-to-add-cash-back-rewards-for-users-of-its-debit-card-2019-10-29,Positive,Venmo to add cash-back rewards for users of its debit card,Market Watch,0
2019-10-29 09:32:38-04:00,PYPL,venmo launches rewards program offering back target sephora dunkin wendy amid increased competition digital payments space venmo today announced first ever rewards program venmo rewards allow users earn automatic cash back purchases pay venmo card select retailers company kicking program limited time cash back deals including back target,"Amid increased competition in the digital payments space, Venmo today announced its first-ever rewards program, Venmo Rewards, which will allow users to earn automatic cash back on purchases when they pay with their Venmo card at select retailers. The company is kicking off the program with limited-time cash back deals, including 5% back at Target, […]",https://techcrunch.com/2019/10/29/venmo-launches-a-rewards-program-offering-up-to-5-back-at-target-sephora-dunkin-wendys/,Positive,"Venmo launches a rewards program offering up to 5% back at Target, Sephora, Dunkin’ & Wendy’s",TechCrunch,0
2019-10-30 14:41:42-04:00,PYPL,ken fisher continues buy paypal caterpillar ken fisher trades portfolio ceo chief investment officer fisher investments bought shares following stocks second third quarters,"Ken Fisher  ( Trades ,  Portfolio ), the CEO and chief investment officer of Fisher Investments, bought shares of the following stocks in both the second and third quarters.",http://www.gurufocus.com/news/972982/ken-fisher-continues-to-buy-paypal-caterpillar,Positive,"Ken Fisher Continues to Buy PayPal, Caterpillar and more",GuruFocus,0
2019-10-31 21:00:08-04:00,PYPL,japanese instant credit provider paidy raises million investors including paypal ventures paidy japanese financial tech startup provides instant credit consumers japan announced today raised total million new financing includes million series c extension investors including paypal ventures debt financing million,"Paidy, a Japanese financial tech startup that provides instant credit to consumers in Japan, announced today that it has raised a total of $143 million in new financing. This includes a $83 million Series C extension from investors including PayPal Ventures and debt financing of $60 million.",https://techcrunch.com/2019/10/31/japanese-instant-credit-provider-paidy-raises-143-million-from-investors-including-paypal-ventures/,Positive,Japanese instant-credit provider Paidy raises $143 million from investors including PayPal Ventures,TechCrunch,0
2019-11-01 07:39:00-04:00,PYPL,bought paypal stock trades high multiple closer examination shows could undervalued,"It trades for a high multiple, but a closer examination shows that it could be undervalued.",https://www.fool.com/investing/2019/11/01/why-i-just-bought-paypal-stock.aspx,Positive,Why I Just Bought PayPal Stock,The Motley Fool,0
2019-11-01 13:57:38-04:00,PYPL,stocks buy big winners earnings season seven stocks buy big winners earnings season plus names long runways growth ahead,"These seven stocks to buy were all big winners this earnings season. Plus, they're names that have long runways to growth ahead.",https://investorplace.com/2019/11/these-7-stocks-to-buy-were-big-winners-this-earnings-season/,Positive,These 7 Stocks to Buy Were Big Winners This Earnings Season,InvestorPlace,0
2019-11-01 13:58:00-04:00,PYPL,paypal venmo business charts venmo quickly growing solid contributor company revenue,Venmo is quickly growing into a solid contributor to the company's revenue.,https://www.fool.com/investing/2019/11/01/paypals-venmo-business-in-3-charts.aspx,Positive,PayPal’s Venmo Business in 3 Charts,The Motley Fool,0
2019-11-01 15:35:28-04:00,PYPL,paypal stock paypal stock,Why I Own PayPal Stock,https://seekingalpha.com/article/4301594-paypal-stock,Positive,Why I Own PayPal Stock,Seeking Alpha,0
2019-11-02 10:02:00-04:00,PYPL,investors worried paypal growth rate slowing recently explanations,"It's been slowing recently, but there are explanations.",https://www.fool.com/investing/2019/11/02/paypals-growth-rate-slowed-should-investors-be-wor.aspx,Positive,Should Investors Be Worried About PayPal's Growth Rate?,The Motley Fool,0
2019-11-03 12:00:00-05:00,PYPL,venmo copying yet another cash app feature venmo rewards app version cash boosts,Venmo Rewards is the app's version of Cash Boosts.,https://www.fool.com/investing/2019/11/03/venmo-is-copying-yet-another-cash-app-feature.aspx,Neutral,Venmo Is Copying Yet Another Cash App Feature,The Motley Fool,0
2019-11-03 18:31:00-05:00,PYPL,paypal best days ahead paypal setting deep roots payment services industry across globe,PayPal is setting deep roots in the payment-services industry across the globe.,https://www.fool.com/investing/2019/11/03/why-paypals-best-days-are-ahead.aspx,Positive,Why PayPal's Best Days Are Ahead,The Motley Fool,0
2019-11-03 22:19:03-05:00,PYPL,paypal billion opportunity part story paypal billion opportunity part story,PayPal's $100-Billion Opportunity Is Just Part Of The Story,https://seekingalpha.com/article/4302012-paypals-100-billion-opportunity-just-part-story,Positive,PayPal's $100-Billion Opportunity Is Just Part Of The Story,Seeking Alpha,0
2019-11-05 12:05:09-05:00,PYPL,paypal remains better buy ebay despite valuation gap however exclude share count reduction past five years consider net income non gaap basis rather eps ebay net income rose far modest growth rate post paypal remains better buy ebay despite valuation gap appeared first investorplace,"However, if you exclude the 30% share count reduction over the past five years, and consider net income on a non-GAAP basis rather than EPS, eBay’s net income rose by just 1.6%, a far more modest growth rate. 
The post PayPal Remains a Better Buy Than eBay Despite Valuation Gap appeared first on InvestorPlace.",https://investorplace.com/2019/11/paypal-remains-a-better-buy-than-ebay-despite-valuation-gap/,Positive,PayPal Remains a Better Buy Than eBay Despite Valuation Gap,InvestorPlace,0
2019-11-07 05:16:34-05:00,PYPL,fast paypal stock get investors fretting little paypal stock valuation quarters like past one come pike situation change,"Investors are fretting a little over PayPal stock's valuation. As more quarters like this past one come down the pike, that situation will change.",https://investorplace.com/2019/11/how-fast-can-paypal-stock-get-to-200/,Positive,How Fast Can PayPal Stock Get to $200?,InvestorPlace,0
2019-11-07 13:21:11-05:00,PYPL,options bulls bet fintech stock halftime report trader jon najarian spots unusual options activity shares paypal mgm,"""Halftime Report"" trader Jon Najarian spots unusual options activity in shares of Paypal and MGM",https://www.youtube.com/watch?v=xepSbuniinw,Positive,Options bulls bet on this fintech stock,CNBC Television,0
2019-11-07 16:35:05-05:00,PYPL,jon najarian highlights unusual activity paypal freeport mcmoran cnbc fast money halftime report jon najarian spoke unusual options activity paypal holdings inc nasdaq pypl,"On CNBC's ""Fast Money Halftime Report,"" Jon Najarian spoke about unusual options activity in Paypal Holdings Inc (NASDAQ: PYPL).",https://www.benzinga.com/markets/options/19/11/14762414/jon-najarian-highlights-unusual-activity-in-paypal-and-freeport-mcmoran,Positive,Jon Najarian Highlights Unusual Activity In PayPal And Freeport-McMoRan,Benzinga,0
2019-11-08 11:56:05-05:00,PYPL,people time next day bank transfers paypal knew along patience virtue except venmo,"Patience is a virtue, except on Venmo.",https://www.fool.com/investing/2019/11/08/people-dont-have-time-for-next-day-bank-transfers.aspx,Positive,"People Don't Have Time for Next-Day Bank Transfers, and PayPal Knew It All Along",The Motley Fool,0
2019-11-11 13:12:09-05:00,PYPL,analyst increasingly convinced venmo monetization prospects venmo yet proven meaningful contributor paypal holdings inc nasdaq pypl,Venmo hasn’t yet proven itself a meaningful contributor to PayPal Holdings Inc (NASDAQ: PYPL).,https://www.benzinga.com/analyst-ratings/analyst-color/19/11/14777722/why-this-analyst-is-increasingly-convinced-of-venmos-monetization-prospects,Positive,Why This Analyst Is Increasingly Convinced Of Venmo's Monetization Prospects,Benzinga,0
2019-11-12 06:00:01-05:00,PYPL,need send cash us paypal xoom wants help xoom teaming walmart ria provide money transfers throughout country,Xoom is teaming up with Walmart and Ria to provide money transfers throughout the country.,https://www.cnet.com/news/need-to-send-cash-in-the-us-paypals-xoom-wants-to-help/,Positive,Need to send cash in the US? PayPal's Xoom wants to help,CNET,0
2019-11-12 12:22:06-05:00,PYPL,buy calls bet short term paypal pop paypal pulled back historically bullish trendline,PayPal just pulled back to a historically bullish trendline,https://www.forbes.com/sites/greatspeculations/2019/11/12/buy-calls-to-bet-on-a-short-term-paypal-pop/,Positive,Buy Calls to Bet on a Short-Term PayPal Pop,Forbes,0
2019-11-12 12:23:23-05:00,PYPL,deep dive sales winners third quarter include netflix autodesk paypal question third quarter earnings season pretty bad always companies outperform listed group sales growth winners,"There’s no question that third-quarter earnings season has been pretty bad. But there are always companies that outperform, and we have listed a group of sales-growth winners below.",https://www.marketwatch.com/story/sales-winners-in-the-third-quarter-include-netflix-autodesk-and-paypal-2019-11-12,Positive,"Deep Dive: Sales winners in the third quarter include Netflix, Autodesk and PayPal",Market Watch,0
