time,symbol,text,raw_text,url,src_sentiment,raw_title,source_name,sentiment
2020-02-27 18:49:33-05:00,ADBE,jim cramer tech stocks buy coronavirus plagued market anything even better outbreak gets worse mad money host said,"""If anything, some of them should do even better as this outbreak gets worse,"" the ""Mad Money"" host said.",https://www.cnbc.com/2020/02/27/jim-cramer-10-tech-stocks-to-buy-now-in-a-coronavirus-plagued-market.html,Positive,Jim Cramer: 10 tech stocks to buy now in this coronavirus-plagued market,CNBC,0
2020-02-27 10:45:13-05:00,ADBE,company stock worth look creative cloud pushes envelope company quickly moving best software cloud adbe stock could soon reclaim time high price point post company stock worth look creative cloud pushes envelope appeared first investorplace,"With Adobe quickly moving its best software into the cloud, ADBE stock could soon reclaim its all-time-high price point.
The post Adobe Stock Is Worth a Look as Creative Cloud Pushes the Envelope appeared first on InvestorPlace.",https://investorplace.com/2020/02/adobe-adbe-stock-creative-cloud-pushes-envelope/,Positive,Adobe Stock Is Worth a Look as Creative Cloud Pushes the Envelope,InvestorPlace,0
2020-02-26 14:51:31-05:00,ADBE,company stock looks poised climb pdf recognizable catalyst adbe stock investors company sits forefront growing markets creative cloud disruptive concept helped stock gain past months compared gain p north american expanded technology software index period post company stock looks poised climb appeared first investorplace,"While PDF is a recognizable catalyst for ADBE stock investors, the company sits at the forefront of some other growing markets, such as the creative cloud, a disruptive concept that has helped the stock gain 44.69% over the past 12 months compared to a 27.24% gain for the S&P North American Expanded Technology Software Index over the same period.
The post Why Adobe Stock Looks Poised to Climb appeared first on InvestorPlace.",https://investorplace.com/2020/02/adbe-stock-is-a-star-among-software-stocks-a-trend-likely-to-continue/,Positive,Why Adobe Stock Looks Poised to Climb,InvestorPlace,-1
2020-02-26 12:45:06-05:00,ADBE,company adbe incredible growth stock reasons company adbe well positioned outperform market exhibits average growth financials,"Adobe (ADBE) is well positioned to outperform the market, as it exhibits above-average growth in financials.",http://www.zacks.com/stock/news/785288/adobe-adbe-is-an-incredible-growth-stock-3-reasons-why,Positive,Adobe (ADBE) is an Incredible Growth Stock: 3 Reasons Why,Zacks Investment Research,-1
2020-02-26 09:29:26-05:00,ADBE,company ceo coronavirus impact shifting strategy company ceo shantanu narayen joins squawk box discuss coronavirus outbreak market sell headwinds facing company,"Adobe CEO Shantanu Narayen joins ""Squawk Box"" to discuss the coronavirus outbreak, the market sell-off, headwinds facing Adobe and more.",https://www.youtube.com/watch?v=JeGIhQhmqgk,Negative,"Adobe CEO on coronavirus impact, shifting to B2B strategy and more",CNBC Television,-1
2020-02-25 12:25:51-05:00,ADBE,company stock could hit reasons company long term winner given high demand products large earnings growth adbe stock one best,"Adobe is a long-term winner. And given high demand for its products and large earnings growth, ADBE stock of one of the best to own for 2020.",https://investorplace.com/2020/02/top-reasons-adbe-stock-could-hit-450-2020/,Positive,Adobe Stock Could Hit $450 in 2020 for These Reasons,InvestorPlace,-1
2020-02-23 12:14:00-05:00,ADBE,top saas stocks buy right subscription businesses poised outperform broader market,These subscription businesses are poised to outperform the broader market.,https://www.fool.com/investing/2020/02/23/4-top-saas-stocks-to-buy-right-now.aspx,Positive,4 Top SaaS Stocks to Buy Right Now,The Motley Fool,0
2020-02-21 08:50:00-05:00,ADBE,salesforce vs company better digital transformation investment shaping epic battle investors need worry picking one,"It’s shaping up to be an epic battle, but investors don’t need to worry about picking just one.",https://www.fool.com/investing/2020/02/21/salesforce-vs-adobe-better-digital-transformation.aspx,Neutral,Salesforce vs. Adobe: Which Is a Better Digital Transformation Investment?,The Motley Fool,0
2020-02-20 07:51:00-05:00,ADBE,major stock indexes heading milestones top picks stable u economy accommodative fed better expected corporate earnings guidance going add fuel stock market momentum,"A stable U.S. economy, an accommodative Fed and better-than expected corporate earnings and guidance is only going to add fuel to stock market momentum.",http://www.zacks.com/stock/news/774884/major-stock-indexes-heading-for-milestones-5-top-picks,Positive,Major Stock Indexes Heading for Milestones: 5 Top Picks,Zacks Investment Research,0
2020-02-19 17:45:16-05:00,ADBE,company systems adbe outpaces stock market gains know company systems adbe closed latest trading session marking move prior day,"Adobe Systems (ADBE) closed at $383.28 in the latest trading session, marking a +1.17% move from the prior day.",http://www.zacks.com/stock/news/773963/adobe-systems-adbe-outpaces-stock-market-gains-what-you-should-know,Positive,Adobe Systems (ADBE) Outpaces Stock Market Gains: What You Should Know,Zacks Investment Research,0
2020-02-19 13:11:27-05:00,ADBE,company creative cloud seen pushing software stock higher survey data indicates company creative cloud business room growth wall street analyst said wednesday company stock notched fresh time high news,"Survey data indicates that Adobe's Creative Cloud business has room for further growth, a Wall Street analyst said Wednesday. Adobe stock notched a fresh all-time high on the news.",https://www.investors.com/news/technology/adbe-stock-hits-record-high-creative-cloud-survey/,Positive,Adobe Creative Cloud Seen Pushing Software Stock Higher,Investors Business Daily,0
2020-02-19 09:00:40-05:00,ADBE,company celebrates photoshop anniversary new desktop mobile features company photoshop celebrates birthday today time app pretty much become synonymous photo editing surely plenty retrospectives,"Adobe’s Photoshop celebrates its 30th birthday today. Over that time, the app has pretty much become synonymous with photo editing and there will surely be plenty of retrospectives.",https://techcrunch.com/2020/02/19/adobe-celebrates-photoshops-30th-anniversary-with-new-desktop-and-mobile-features/,Positive,Adobe celebrates Photoshop’s 30th anniversary with new desktop and mobile features,TechCrunch,0
2020-02-18 15:08:11-05:00,ADBE,company expensive despite recent rally company expensive despite recent rally,Adobe: Not Expensive Despite The Recent Rally,https://seekingalpha.com/article/4325004-adobe-not-expensive-despite-recent-rally,Positive,Adobe: Not Expensive Despite The Recent Rally,Seeking Alpha,0
2020-02-18 14:45:38-05:00,ADBE,adbe stock still viable look gig economy answer adbe stock screaming new highs investors right ask momentum continue longer term gig economy likely prove,"With ADBE stock screaming to new highs, investors are right to ask if this momentum can continue. Longer term, the gig economy will likely prove that it can.",https://investorplace.com/2020/02/is-adbe-stock-still-viable-look-to-the-gig-economy-for-the-answer/,Positive,Is ADBE Stock Still Viable? Look to the Gig Economy for the Answer,InvestorPlace,0
2020-02-10 09:25:20-05:00,ADBE,company stock buy proven otherwise adbe stock soared october lows valuation concern wonderful business worth paying,"ADBE stock has soared 40% from October lows, and valuation is a concern. But this is a wonderful business worth paying up for.",https://investorplace.com/2020/02/adbe-stock-buy-proven-otherwise/,Positive,Adobe Stock Is a Buy Until Proven Otherwise,InvestorPlace,0
2020-02-07 14:00:27-05:00,ADBE,trade company stock right big profits company fantastic growth story snagging fresh record highs week said trade adbe stock big profits,"Adobe has been a fantastic growth story, snagging fresh record highs this week. That said, here's how to trade ADBE stock for big profits.",https://investorplace.com/2020/02/how-to-trade-adbe-stock-right-now-big-profits/,Positive,How to Trade Adobe Stock Right Now for Big Profits,InvestorPlace,0
2020-02-07 05:30:00-05:00,ADBE,company continue top line growth fy company digital media business consisting primarily revenue subscription expected contribute billion company revenues making company billion expected revenues,"Adobe’s Digital Media business, consisting primarily of revenue from subscription, is expected to contribute $9.1 billion to Adobe’s 2020 revenues, making up 68.1% of Adobe’s $13.4 billion in expected revenues for 2020.",https://www.forbes.com/sites/greatspeculations/2020/02/07/will-adobe-continue-top-line-growth-in-fy-2020/,Neutral,Will Adobe Continue Top Line Growth In FY 2020?,Forbes,0
2020-02-06 11:59:22-05:00,ADBE,cloud stocks buy big gains cloud stocks optimally positioned rip higher five cloud giants lead pack throughout year,"Cloud stocks are optimally positioned to rip higher in 2020, and these five cloud giants should lead the pack throughout the year.",https://investorplace.com/2020/02/5-cloud-stocks-to-buy-big-gains-2020/,Positive,5 Cloud Stocks to Buy for Big Gains in 2020,InvestorPlace,0
2020-02-06 06:15:58-05:00,ADBE,buy long term winner company stock dip company stock outperformed p big way three straight years streak stop post buy long term winner company stock dip appeared first investorplace investorplace toxic pot stocks avoid utility stocks buy offer juicy dividends gold silver stocks profit fear trade top companies careful data,"Adobe stock has outperformed the S&P 500 in a big way for three straight years and the streak won't stop in 2020
The post Buy Long-Term Winner Adobe Stock On the Dip appeared first on InvestorPlace.
More From InvestorPlace
		
					
				
					2 Toxic Pot Stocks You Should Avoid				
			
					
				
					7 Utility Stocks to Buy That Offer Juicy Dividends				
			
					
				
					10 Gold and Silver Stocks to Profit Off 2020’s Fear Trade				
			
					
				
					3 Top Companies That Should Be More Careful With Your Data",https://investorplace.com/2020/02/buy-long-term-winner-adobe-stock-on-the-dip/,Positive,Buy Long-Term Winner Adobe Stock On the Dip,InvestorPlace,0
2020-02-05 11:22:30-05:00,ADBE,company stock could head higher tread carefully doubt company strong business adbe stock strong buy today prices,There's no doubt Adobe is a strong business. But is ADBE stock a strong buy at today's prices?,https://investorplace.com/2020/02/adbe-stock-head-higher-tread-carefully/,Positive,"Adobe Stock Could Head Higher, but Tread Carefully",InvestorPlace,0
2020-02-05 07:10:23-05:00,ADBE,adbe stock certain hit year shortly company reported results december investorplace luke lango highlighted many reasons company stock long term winner company captured niche part cloud ensuring sales continue grow years come,"Shortly after Adobe reported its Q4 2019 results in December, InvestorPlace’s Luke Lango, highlighted the many reasons the company’s stock is a long-term winner. That’s because Adobe’s captured a niche part of the cloud, ensuring that its sales continue to grow for years to come.",https://investorplace.com/2020/02/adbe-stock-hit-400-in-2020/,Positive,ADBE Stock Is All but Certain to Hit $400 This Year,InvestorPlace,0
2020-02-04 12:45:06-05:00,ADBE,looking growth stock reasons company adbe solid choice company adbe could produce exceptional returns solid growth attributes,Adobe (ADBE) could produce exceptional returns because of its solid growth attributes.,http://www.zacks.com/stock/news/749052/looking-for-a-growth-stock-3-reasons-why-adobe-adbe-is-a-solid-choice,Positive,Looking for a Growth Stock? 3 Reasons Why Adobe (ADBE) is a Solid Choice,Zacks Investment Research,0
2020-02-04 08:45:46-05:00,ADBE,monopolies analyzing company prospects beat market monopolies analyzing company prospects beat market,On Monopolies: Analyzing Adobe's Prospects To Beat The Market,https://seekingalpha.com/article/4321158-on-monopolies-analyzing-adobes-prospects-to-beat-market,Positive,On Monopolies: Analyzing Adobe's Prospects To Beat The Market,Seeking Alpha,0
2020-02-03 07:31:51-05:00,ADBE,company terrific business held long term company terrific business held long term,Adobe: A Terrific Business Which Should Be Held Long Term,https://seekingalpha.com/article/4320907-adobe-terrific-business-which-should-be-held-long-term,Positive,Adobe: A Terrific Business Which Should Be Held Long Term,Seeking Alpha,1
2020-01-31 11:30:10-05:00,ADBE,company systems adbe stock outpacing computer technology peers year adbe outperforming computer technology stocks year,Is  (ADBE) Outperforming Other Computer and Technology Stocks This Year?,http://www.zacks.com/stock/news/742927/is-adobe-systems-adbe-stock-outpacing-its-computer-and-technology-peers-this-year,Neutral,Is Adobe Systems (ADBE) Stock Outpacing Its Computer and Technology Peers This Year?,Zacks Investment Research,0
2020-01-27 19:13:59-05:00,ADBE,salesforce vs company top tech rivalry says jim cramer lately companies encroaching turf cnbc jim cramer says,"""Lately both companies have been encroaching on each other's turf,"" CNBC's Jim Cramer says.",https://www.youtube.com/watch?v=_iy8Ioi64xg,Neutral,"Salesforce vs. Adobe top tech rivalry, says Jim Cramer",CNBC Television,0
2020-01-27 17:45:18-05:00,ADBE,company systems adbe stock moves know company systems adbe closed recent trading day moving previous trading session,"Adobe Systems (ADBE) closed the most recent trading day at $346.90, moving -1.27% from the previous trading session.",http://www.zacks.com/stock/news/735394/adobe-systems-adbe-stock-moves-127-what-you-should-know,Neutral,Adobe Systems (ADBE) Stock Moves -1.27%: What You Should Know,Zacks Investment Research,0
2020-01-27 16:45:11-05:00,ADBE,adbe stock buy right company earnings chart show company successfully pivoted cloud based subscriptions new acquisitions raise risks,Adobe successfully pivoted to cloud-based subscriptions. But new acquisitions raise risks.,https://www.investors.com/news/adobe-stock-buy-now/,Negative,"Is ADBE Stock A Buy Right Now? Here's What Adobe Earnings, Chart Show",Investors Business Daily,0
2020-01-27 09:30:07-05:00,ADBE,cloud stocks one highest growth secular tech trends cloud computing,One of the highest-growth secular tech trends of the 2020s will be cloud computing.,https://www.benzinga.com/analyst-ratings/analyst-color/20/01/15181375/8-cloud-stocks-to-own-in-2020,Positive,8 Cloud Stocks To Own In 2020,Benzinga,0
2020-01-26 08:15:00-05:00,ADBE,stocks turned million use example find next big thing,And how to use their example to find the next big thing.,https://www.fool.com/investing/2020/01/26/2-stocks-that-turned-500-into-1-million.aspx,Positive,2 Stocks That Turned $500 Into $1 Million,The Motley Fool,0
2020-01-24 10:36:39-05:00,ADBE,boosted enterprise software stocks buy enterprise software stocks look poised big gains four stocks likely lead pack higher,"Enterprise software stocks look poised for big gains in 2020, and these four stocks will likely lead the pack higher.",https://investorplace.com/2020/01/4-enterprise-software-stocks-to-buy-for-2020/,Positive,4 Boosted Enterprise Software Stocks to Buy in 2020,InvestorPlace,0
2020-01-21 12:40:15-05:00,ADBE,top tech stocks score major analyst upgrades ahead earnings well underway investors already looking past mega gains p closer nasdaq,"Now that 2020 is well underway, investors should already be looking past the 2019 mega-gains of 28.9% in the S&P 500 and closer to 35% for the Nasdaq.",https://247wallst.com/technology-3/2020/01/21/10-top-tech-stocks-for-2020-score-major-analyst-upgrades-ahead-of-earnings/,Positive,10 Top Tech Stocks for 2020 Score Major Analyst Upgrades Ahead of Earnings,24/7 Wall Street,0
2020-01-21 11:19:32-05:00,ADBE,company shares surge massive demand software company keeps making big profits shareholders could rewarded handsomely,"As the software company keeps making big profits, shareholders could be rewarded handsomely.",https://www.investopedia.com/adobe-shares-surge-with-massive-demand-4782565,Positive,Adobe Shares Surge With Massive Demand,Investopedia,0
2020-01-21 07:00:49-05:00,ADBE,software growth stocks buy cloud digital transformation ai kick fuels top line growth software growth stocks least four megatrends technology cloud computing digital transformation big data analytics artificial intelligence,"What fuels top-line growth for software growth stocks? At least four megatrends in technology: cloud computing, digital transformation, big data analytics and artificial intelligence.",https://www.investors.com/news/technology/saas-stocks-cloud-stocks/,Positive,"Software Growth Stocks To Buy: Cloud, Digital Transformation, AI Kick In",Investors Business Daily,0
2020-01-17 17:35:07-05:00,ADBE,company long term winner company long term winner,Adobe: Long-Term Winner,https://seekingalpha.com/article/4317684-adobe-long-term-winner,Positive,Adobe: Long-Term Winner,Seeking Alpha,0
2020-01-17 09:21:54-05:00,ADBE,company stock gains oppenheimer upgrade autodesk gets downgrade shares company systems inc adbe premarket trading friday oppenheimer analyst brian schwartz upgraded stock outperform perform autodesk inc,"Shares of Adobe Systems Inc. ADBE, +0.71% are up 0.9% in premarket trading Friday after Oppenheimer analyst Brian Schwartz upgraded the stock to outperform from perform, while Autodesk Inc.",https://www.marketwatch.com/story/adobe-stock-gains-after-oppenheimer-upgrade-while-autodesk-gets-a-downgrade-2020-01-17,Positive,"Adobe stock gains after Oppenheimer upgrade, while Autodesk gets a downgrade",Market Watch,0
2020-01-15 16:41:00-05:00,ADBE,snap mega cap stocks impressive growth prospects mega caps usually largest established companies stock market tend stable many pay dividends based earnings,"Mega-caps, usually the largest and most established companies in the stock market, tend to be stable, and many of them pay dividends based on their earnings.",http://www.zacks.com/stock/news/719642/snap-up-5-mega-cap-stocks-with-impressive-growth-prospects,Positive,Snap Up 5 Mega-Cap Stocks with Impressive Growth Prospects,Zacks Investment Research,0
2020-01-15 11:30:10-05:00,ADBE,company systems adbe outpaced computer technology stocks year adbe outperforming computer technology stocks year,Is  (ADBE) Outperforming Other Computer and Technology Stocks This Year?,http://www.zacks.com/stock/news/719271/has-adobe-systems-adbe-outpaced-other-computer-and-technology-stocks-this-year,Positive,Has Adobe Systems (ADBE) Outpaced Other Computer and Technology Stocks This Year?,Zacks Investment Research,0
2020-01-14 12:45:04-05:00,ADBE,reasons growth investors love company adbe company adbe possesses solid growth attributes could help handily outperform market,"Adobe (ADBE) possesses solid growth attributes, which could help it handily outperform the market.",http://www.zacks.com/stock/news/717720/3-reasons-growth-investors-will-love-adobe-adbe,Positive,3 Reasons Growth Investors Will Love Adobe (ADBE),Zacks Investment Research,0
2020-01-14 12:00:06-05:00,ADBE,company systems adbe one week know company systems adbe takes top stock pick momentum investors let find,Does Adobe Systems (ADBE) have what it takes to be a top stock pick for momentum investors? Let's find out.,http://www.zacks.com/stock/news/717609/adobe-systems-adbe-is-up-241-in-one-week-what-you-should-know,Positive,Adobe Systems (ADBE) Is Up 2.41% in One Week: What You Should Know,Zacks Investment Research,0
2020-01-14 12:00:06-05:00,ADBE,company adbe moves buy rationale behind upgrade company adbe upgraded zacks rank buy reflecting growing optimism company earnings prospects might drive stock higher near term,"Adobe (ADBE) has been upgraded to a Zacks Rank #2 (Buy), reflecting growing optimism about the company's earnings prospects. This might drive the stock higher in the near term.",http://www.zacks.com/stock/news/717614/adobe-adbe-moves-to-buy-rationale-behind-the-upgrade,Positive,Adobe (ADBE) Moves to Buy: Rationale Behind the Upgrade,Zacks Investment Research,0
2020-01-14 07:10:20-05:00,ADBE,jefferies top software picks large cap leaders buy entire technology sector insane run past year question many top companies trading stretched valuations,"The entire technology sector has been on an insane run over the past year, and there is no question that many of the top companies are now trading with very stretched valuations.",https://247wallst.com/technology-3/2020/01/14/jefferies-out-with-top-software-picks-for-2020-4-large-cap-leaders-to-buy-now/,Positive,Jefferies Out With Top Software Picks for 2020: 4 Large-Cap Leaders to Buy Now,24/7 Wall Street,0
2020-01-13 12:55:04-05:00,ADBE,enterprise software stocks predicted keep soaring past year incredible one tech stocks far seems rally continue,"The past year was an incredible one for tech stocks, and so far in 2020 it seems that this rally will continue.",https://247wallst.com/technology-3/2020/01/13/5-enterprise-software-stocks-predicted-to-keep-soaring-in-2020/,Positive,5 Enterprise Software Stocks Predicted to Keep Soaring in 2020,24/7 Wall Street,0
2020-01-13 11:48:09-05:00,ADBE,company experience manager offered cloud native saas application company announced today company experience manager aem available cloud native saas application prior available premises managed service pure cloud native,"Adobe announced today that Adobe Experience Manager (AEM) is now available as a cloud-native SaaS application. Prior to this, it was available on premises or as a managed service, but it wasn’t pure cloud-native.",https://techcrunch.com/2020/01/13/adobe-experience-manager-now-offered-as-cloud-native-saas-application/,Neutral,Adobe Experience Manager now offered as cloud-native SaaS application,TechCrunch,0
2020-01-13 11:06:00-05:00,ADBE,company stock soared creative software leader thriving cloud based renewable subscription model,The creative software leader is thriving with its cloud-based renewable subscription model.,https://www.fool.com/investing/2020/01/13/why-adobe-stock-soared-458-in-2019.aspx,Positive,Why Adobe Stock Soared 45.8% in 2019,The Motley Fool,0
2020-01-11 11:30:05-05:00,ADBE,company adbe since last earnings report company adbe reported earnings days ago next stock,Adobe (ADBE) reported earnings 30 days ago. What's next for the stock?,http://www.zacks.com/stock/news/713043/why-is-adobe-adbe-up-111-since-last-earnings-report,Neutral,Why Is Adobe (ADBE) Up 11.1% Since Last Earnings Report?,Zacks Investment Research,0
2020-01-10 12:37:00-05:00,ADBE,stock research reports chevron accenture company others stock research reports chevron accenture company others,"Stock Research Reports for Chevron, Accenture, Adobe & Others",http://www.zacks.com/research-daily/711596/stock-research-reports-for-chevron-accenture-adobe-others,Neutral,"Stock Research Reports for Chevron, Accenture, Adobe & Others",Zacks Investment Research,0
2020-01-09 11:51:00-05:00,ADBE,hot tech stocks start right outlook markets murky five tech stocks look likely deliver,"The outlook for markets in 2020 is murky, but these five tech stocks look likely to deliver",https://investorplace.com/2020/01/5-hot-tech-stocks-start-2020-right/,Positive,5 Hot Tech Stocks to Start 2020 Off Right,InvestorPlace,0
2020-01-07 12:00:00-05:00,ADBE,top tech stocks buy right tech stocks expected favor amd company twitter among ones poised grow,"Tech stocks are expected to be in favor again in 2020, with AMD, Adobe, and Twitter among the ones poised to grow.",https://www.fool.com/investing/2020/01/07/3-top-tech-stocks-to-buy-right-now.aspx,Positive,3 'Top Tech Stocks' to Buy Right Now',The Motley Fool,0
2020-01-06 07:17:15-05:00,ADBE,stocks highest sales growth according goldman investors seeking stocks beat market goldman sachs identified highest projected sales growth,"For investors seeking stocks than can beat the market in 2020, Goldman Sachs has identified those with the highest projected sales growth.",https://www.investopedia.com/10-stocks-with-the-highest-sales-growth-in-2020-according-to-goldman-4780442,Positive,10 Stocks With the Highest Sales Growth in 2020 According to Goldman,Investopedia,0
2020-01-05 19:31:34-05:00,ADBE,company stock sets new high extremely overbought popular play cloud computing showing signs potential volatility,The popular play on cloud computing is showing signs of potential volatility in 2020.,https://www.investopedia.com/adobe-stock-sets-new-high-but-is-extremely-overbought-4780479,Negative,Adobe Stock Sets New High but Is Extremely Overbought,Investopedia,0
2020-01-03 17:13:53-05:00,ADBE,company cto says ai democratize creative tools company cto abhay parasnis sees shift happening shift people share content wants use creative tools,Adobe CTO Abhay Parasnis sees a shift happening. A shift in how people share content and who wants to use creative tools.,https://techcrunch.com/2020/01/03/adobe-cto-says-ai-will-democratize-creative-tools/,Neutral,Adobe CTO says AI will ‘democratize’ creative tools,TechCrunch,0
2019-12-27 08:30:00-05:00,ADBE,invested company ipo much would worth spoiler alert overall return modest ipo investment veteran tech stock tops seven figures,Spoiler alert: The overall return a modest IPO investment in this veteran tech stock tops seven-figures.,https://www.fool.com/investing/2019/12/27/if-invested-1000-in-adobe-ipo-how-much-have-now.aspx,Positive,"If You Had Invested $1,000 in Adobe's IPO, Here's How Much It Would Be Worth Now",The Motley Fool,0
2019-12-26 14:32:02-05:00,ADBE,company rising clouds company rising clouds,Adobe: Rising To The Clouds,https://seekingalpha.com/article/4314187-adobe-rising-to-clouds,Neutral,Adobe: Rising To The Clouds,Seeking Alpha,0
